### ISSUE TITLE
GKE Sandbox: OpenSSL SSL_read: SSL_ERROR_SYSCALL, errno 104

### ISSUE THREAD

**Issue by angelbarrera92** [google/gvisor#1515]
Hi! I don't know if this is the correct site to publish this kind of issues as it is related to gVisor but on top of GKE.

# Scenario
We are using gke with a nodepool with the GKE Sandbox feature enable. We found and error during an image upload to the telegram API.

## TL;DR

```bash
# curl -X POST "https://api.telegram.org/bot990060833:I_CAN_SEND_YOU_THE_TOKEN/sendPhoto" -F chat_id=334621642 -F photo="@googlelogo_color_92x30dp.png" --verbose
Note: Unnecessary use of -X or --request, POST is already inferred.
*   Trying 149.154.167.220:443...
* TCP_NODELAY set
* Connected to api.telegram.org (149.154.167.220) port 443 (#0)
* ALPN, offering h2
* ALPN, offering http/1.1
* successfully set certificate verify locations:
*   CAfile: /etc/ssl/certs/ca-certificates.crt
  CApath: none
* TLSv1.3 (OUT), TLS handshake, Client hello (1):
* TLSv1.3 (IN), TLS handshake, Server hello (2):
* TLSv1.2 (IN), TLS handshake, Certificate (11):
* TLSv1.2 (IN), TLS handshake, Server key exchange (12):
* TLSv1.2 (IN), TLS handshake, Server finished (14):
* TLSv1.2 (OUT), TLS handshake, Client key exchange (16):
* TLSv1.2 (OUT), TLS change cipher, Change cipher spec (1):
* TLSv1.2 (OUT), TLS handshake, Finished (20):
* TLSv1.2 (IN), TLS handshake, Finished (20):
* SSL connection using TLSv1.2 / ECDHE-RSA-AES128-GCM-SHA256
* ALPN, server accepted to use http/1.1
 Server certificate:
*  subject: OU=Domain Control Validated; CN=api.telegram.org
*  start date: May  4 14:42:31 2018 GMT
*  expire date: May 23 16:17:38 2020 GMT
*  subjectAltName: host "api.telegram.org" matched cert's "api.telegram.org"
*  issuer: C=US; ST=Arizona; L=Scottsdale; O=GoDaddy.com, Inc.; OU=http://certs.godaddy.com/repository/; CN=Go Daddy Secure Certificate Authority - G2
*  SSL certificate verify ok.
> POST /bot990060833:I_CAN_SEND_YOU_THE_TOKEN/sendPhoto HTTP/1.1
> Host: api.telegram.org
> User-Agent: curl/7.66.0
> Accept: */*
> Content-Length: 4142
> Content-Type: multipart/form-data; boundary=------------------------c5bb5ff482d768bf
> Expect: 100-continue
> 
* Mark bundle as not supporting multiuse
< HTTP/1.1 100 Continue
* We are completely uploaded and fine
* OpenSSL SSL_read: SSL_ERROR_SYSCALL, errno 104
* Closing connection 0
curl: (56) OpenSSL SSL_read: SSL_ERROR_SYSCALL, errno 104
```

**curl: (56) OpenSSL SSL_read: SSL_ERROR_SYSCALL, errno 104**

*   `runsc -v:`
```bash
/home/containerd/usr/local/sbin/runsc --version
runsc version google-281502745
spec: 1.0.1-dev 
```
*   `docker version` or `docker info` if more relevant
```bash
docker version
Client:
 Version:           19.03.1
 API version:       1.40
 Go version:        go1.11.2
 Git commit:        74b1e89
 Built:             Wed Oct  9 06:26:18 2019
 OS/Arch:           linux/amd64
 Experimental:      false

Server:
 Engine:
  Version:          19.03.1
  API version:      1.40 (minimum version 1.12)
  Go version:       go1.11.2
  Git commit:       74b1e89
  Built:            Wed Oct  9 06:25:30 2019
  OS/Arch:          linux/amd64
  Experimental:     false
 containerd:
  Version:          1.2.8
  GitCommit:        a4bc1d432a2c33aa2eed37f338dceabb93641310
 runc:
  Version:          1.0.0-rc8
  GitCommit:        425e105d5a03fabd737a126ad93d62a9eeede87f
 docker-init:
  Version:          0.18.0
  GitCommit:        fec3683b971d9c3ef73f284f176672c44b448662
```
*   `uname -a` - `git describe`
```bash
$ uname -a
Linux gke-live-clients-7bd46286-mtrp 4.19.76+ #1 SMP Tue Oct 8 23:17:06 PDT 2019 x86_64 Intel(R) Xeon(R) CPU @ 2.20GHz GenuineIntel GNU/Linux
```
*   Detailed reproduction steps

To debug deeply this problem, we entered one of the nodes via ssh  modifying the docker daemon configuration to run some tests:

First, configure the `runsc` as an available docker runtime:

```bash
cat /etc/docker/daemon.json
{
    "live-restore": true,
    "runtimes": {
        "runsc": {
            "path": "/home/containerd/usr/local/sbin/runsc"
        }
    },
    "storage-driver": "overlay2"
}
```

Then run the following containers to reproduce the error:

1st without gvisor/runsc
```bash
$ docker run  --rm -it -m 128Mi --cpus="0.1" alpine:3.10 /bin/sh
# apk add curl
# curl https://www.google.com/images/branding/googlelogo/2x/googlelogo_color_92x30dp.png --output googlelogo_color_92x30dp.png
# curl -X POST "https://api.telegram.org/bot990060833:I_CAN_SEND_YOU_THE_TOKEN/sendPhoto" -F chat_id=334621642 -F photo="@googlelogo_color_92x30dp.png" --verbose

# TRUNCATED OUTPUT #

< HTTP/1.1 200 OK
< Server: nginx/1.16.1
< Date: Tue, 07 Jan 2020 15:43:53 GMT
< Content-Type: application/json
< Content-Length: 413
< Connection: keep-alive
< Strict-Transport-Security: max-age=31536000; includeSubDomains; preload
< Access-Control-Allow-Origin: *
< Access-Control-Allow-Methods: GET, POST, OPTIONS
< Access-Control-Expose-Headers: Content-Length,Content-Type,Date,Server,Connection
< 
* Connection #0 to host api.telegram.org left intact
{"ok":true,"result":{"message_id":9,"from":{"id":990060833,"is_bot":true,"first_name":"testk8spin","username":"k8spin_bot"},"chat":{"id":334621642,"first_name":"Pau","last_name":"Rosello","username":"paurosello","type":"private"},"date":1578411833,"photo":[{"file_id":"AgADBAADSLIxG3cuoFCCXM-yOT0enWp5qBsABAEAAwIAA20AA-M0BgABFgQ","file_unique_id":"AQADanmoGwAE4zQGAAE","file_size":4066,"width":184,"height":60}]}}/ # 
```

2nd with gvisor/runsc
```bash
$ docker run --runtime=runsc --rm -it -m 128Mi --cpus="0.1" alpine:3.10 /bin/sh
# apk add curl
# curl https://www.google.com/images/branding/googlelogo/2x/googlelogo_color_92x30dp.png --output googlelogo_color_92x30dp.png
# curl -X POST "https://api.telegram.org/bot990060833:I_CAN_SEND_YOU_THE_TOKEN/sendPhoto" -F chat_id=334621642 -F photo="@googlelogo_color_92x30dp.png" --verbose
Note: Unnecessary use of -X or --request, POST is already inferred.
*   Trying 149.154.167.220:443...
* TCP_NODELAY set
* Connected to api.telegram.org (149.154.167.220) port 443 (#0)
* ALPN, offering h2
* ALPN, offering http/1.1
* successfully set certificate verify locations:
*   CAfile: /etc/ssl/certs/ca-certificates.crt
  CApath: none
* TLSv1.3 (OUT), TLS handshake, Client hello (1):
* TLSv1.3 (IN), TLS handshake, Server hello (2):
* TLSv1.2 (IN), TLS handshake, Certificate (11):
* TLSv1.2 (IN), TLS handshake, Server key exchange (12):
* TLSv1.2 (IN), TLS handshake, Server finished (14):
* TLSv1.2 (OUT), TLS handshake, Client key exchange (16):
* TLSv1.2 (OUT), TLS change cipher, Change cipher spec (1):
* TLSv1.2 (OUT), TLS handshake, Finished (20):
* TLSv1.2 (IN), TLS handshake, Finished (20):
* SSL connection using TLSv1.2 / ECDHE-RSA-AES128-GCM-SHA256
* ALPN, server accepted to use http/1.1
 Server certificate:
*  subject: OU=Domain Control Validated; CN=api.telegram.org
*  start date: May  4 14:42:31 2018 GMT
*  expire date: May 23 16:17:38 2020 GMT
*  subjectAltName: host "api.telegram.org" matched cert's "api.telegram.org"
*  issuer: C=US; ST=Arizona; L=Scottsdale; O=GoDaddy.com, Inc.; OU=http://certs.godaddy.com/repository/; CN=Go Daddy Secure Certificate Authority - G2
*  SSL certificate verify ok.
> POST /bot990060833:I_CAN_SEND_YOU_THE_TOKEN/sendPhoto HTTP/1.1
> Host: api.telegram.org
> User-Agent: curl/7.66.0
> Accept: */*
> Content-Length: 4142
> Content-Type: multipart/form-data; boundary=------------------------c5bb5ff482d768bf
> Expect: 100-continue
> 
* Mark bundle as not supporting multiuse
< HTTP/1.1 100 Continue
* We are completely uploaded and fine
* OpenSSL SSL_read: SSL_ERROR_SYSCALL, errno 104
* Closing connection 0
curl: (56) OpenSSL SSL_read: SSL_ERROR_SYSCALL, errno 104
```

I can not reproduce it locally even with the same `runsc` and `docker` versions/binaries.

Let me know if is needed more information! (the api token for example)

Thanks!

**Comment by angelbarrera92** [comment]
Ok team! i configured the docker daemon `/etc/docker/daemon.json` with an aditional `runtime argument` and now it is working *(docker on top of the gke node)*.

New `/etc/docker/daemon.json`
```json
{
    "live-restore": true,
    "runtimes": {
        "runsc": {
            "path": "/home/containerd/usr/local/sbin/runsc",
            "runtimeArgs": [
                "--network=host"
            ]
        }
    },
    "storage-driver": "overlay2"
}
```

Full commands:
```bash
$ sudo systemctl restart docker
$ docker run --runtime=runsc  --rm -it -m 128Mi --cpus="0.1" alpine:3.10 /bin/sh
/ # apk add curl
fetch http://dl-cdn.alpinelinux.org/alpine/v3.10/main/x86_64/APKINDEX.tar.gz
fetch http://dl-cdn.alpinelinux.org/alpine/v3.10/community/x86_64/APKINDEX.tar.gz
(1/4) Installing ca-certificates (20190108-r0)
(2/4) Installing nghttp2-libs (1.39.2-r0)
(3/4) Installing libcurl (7.66.0-r0)
(4/4) Installing curl (7.66.0-r0)
Executing busybox-1.30.1-r2.trigger
Executing ca-certificates-20190108-r0.trigger
OK: 7 MiB in 18 packages
/ # curl https://www.google.com/images/branding/googlelogo/2x/googlelogo_color_92x30dp.png --output googlelogo_color_92x30dp.png
  % Total    % Received % Xferd  Average Speed   Time    Time     Time  Current
             
                    Dload  Upload   Total   Spent    Left  Speed
100  3831  100  3831    0     0   2962      0  0:00:01  0:00:01 --:--:--  3195
/ # 
/ # curl -X POST "https://api.telegram.org/bot990060833:I_CAN_SEND_YOU_THE_TOKEN/sendPhoto" -F chat_id=334621642 -F photo="@googlelogo_color_92x30dp.png" --verbose
Note: Unnecessary use of -X or --request, POST is already inferred.
*   Trying 149.154.167.220:443...
* TCP_NODELAY set
* Connected to api.telegram.org (149.154.167.220) port 443 (#0)
* ALPN, offering h2
* ALPN, offering http/1.1
* successfully set certificate verify locations:
*   CAfile: /etc/ssl/certs/ca-certificates.crt
  CApath: none
* TLSv1.3 (OUT), TLS handshake, Client hello (1):
* TLSv1.3 (IN), TLS handshake, Server hello (2):
* TLSv1.2 (IN), TLS handshake, Certificate (11):
* TLSv1.2 (IN), TLS handshake, Server key exchange (12):
* TLSv1.2 (IN), TLS handshake, Server finished (14):
* TLSv1.2 (OUT), TLS handshake, Client key exchange (16):
* TLSv1.2 (OUT), TLS change cipher, Change cipher spec (1):
* TLSv1.2 (OUT), TLS handshake, Finished (20):
* TLSv1.2 (IN), TLS handshake, Finished (20):
* SSL connection using TLSv1.2 / ECDHE-RSA-AES128-GCM-SHA256
* ALPN, server accepted to use http/1.1
* Server certificate:
*  subject: OU=Domain Control Validated; CN=api.telegram.org
*  start date: May  4 14:42:31 2018 GMT
*  expire date: May 23 16:17:38 2020 GMT
*  subjectAltName: host "api.telegram.org" matched cert's "api.telegram.org"
*  issuer: C=US; ST=Arizona; L=Scottsdale; O=GoDaddy.com, Inc.; OU=http://certs.godaddy.com/repository/; CN=Go Daddy Secure Certificate Authority - G2
*  SSL certificate verify ok.
> POST /bot990060833:I_CAN_SEND_YOU_THE_TOKEN/sendPhoto HTTP/1.1
> Host: api.telegram.org
> User-Agent: curl/7.66.0
> Accept: */*
> Content-Length: 4142
> Content-Type: multipart/form-data; boundary=------------------------bf3d24a2372d6a96
> Expect: 100-continue
> 
* Mark bundle as not supporting multiuse
< HTTP/1.1 100 Continue
* We are completely uploaded and fine
* Mark bundle as not supporting multiuse
< HTTP/1.1 401 Unauthorized
< Server: nginx/1.16.1
< Date: Tue, 07 Jan 2020 20:29:26 GMT
< Content-Type: application/json
< Content-Length: 58
< Connection: keep-alive
< Strict-Transport-Security: max-age=31536000; includeSubDomains; preload
< Access-Control-Allow-Origin: *
< Access-Control-Expose-Headers: Content-Length,Content-Type,Date,Server,Connection
< 
* Connection #0 to host api.telegram.org left intact
{"ok":false,"error_code":401,"description":"Unauthorized"}/ #
```

I have to say that it was working without this argument for months, but we lose it when we update from gke 1.13 to 1.14 and 1.15.

And for sure, it does not work yet on top of kubernetes/gke (this test are executed entering the node via ssh and running docker containers with and without runsc). Kubernetes/gke has it's own containerd configuration i guess that can not be modified (readonly filesystem).

**Comment by hbhasker** [comment]
So --network=host basically bypasses the gVisor's network stack and uses the host networking stack. Which is mostly the same as using runc and that's why this works. The bug is probably in netstack. That said I would need an API key so that I can reproduce this and look at the packet traces. Or alternatively if you can do a pcap of the request and provide the pcap that will work too. 

I tried reproducing this locally with an HTTPS nodejs server and I couldn't reproduce it. The connection terminates gracefully.

**Comment by hbhasker** [comment]
docker run --runtime=runsc-head --sysctl net.ipv6.conf.all.disable_ipv6=1 --rm -it  alpine:3.10 /bin/sh
/ # apk add curl
fetch http://dl-cdn.alpinelinux.org/alpine/v3.10/main/x86_64/APKINDEX.tar.gz
fetch http://dl-cdn.alpinelinux.org/alpine/v3.10/community/x86_64/APKINDEX.tar.gz
(1/4) Installing ca-certificates (20190108-r0)
(2/4) Installing nghttp2-libs (1.39.2-r0)
(3/4) Installing libcurl (7.66.0-r0)
(4/4) Installing curl (7.66.0-r0)
Executing busybox-1.30.1-r2.trigger
Executing ca-certificates-20190108-r0.trigger
OK: 7 MiB in 18 packages
/ # echo asdfasdfasdf > /tmp/x
/ # curl -X POST "https://api.telegram.org/bot990060833:I_CAN_SEND_YOU_THE_TOKEN/sendPhoto" -F chat_id=334621642 -F photo="/tmp/x" --verbose
Note: Unnecessary use of -X or --request, POST is already inferred.
*   Trying 149.154.167.220:443...
* TCP_NODELAY set
* Connected to api.telegram.org (149.154.167.220) port 443 (#0)
* ALPN, offering h2
* ALPN, offering http/1.1
* successfully set certificate verify locations:
*   CAfile: /etc/ssl/certs/ca-certificates.crt
  CApath: none
* TLSv1.3 (OUT), TLS handshake, Client hello (1):
* TLSv1.3 (IN), TLS handshake, Server hello (2):
* TLSv1.2 (IN), TLS handshake, Certificate (11):
* TLSv1.2 (IN), TLS handshake, Server key exchange (12):
* TLSv1.2 (IN), TLS handshake, Server finished (14):
* TLSv1.2 (OUT), TLS handshake, Client key exchange (16):
* TLSv1.2 (OUT), TLS change cipher, Change cipher spec (1):
* TLSv1.2 (OUT), TLS handshake, Finished (20):
* TLSv1.2 (IN), TLS handshake, Finished (20):
* SSL connection using TLSv1.2 / ECDHE-RSA-AES128-GCM-SHA256
* ALPN, server accepted to use http/1.1
* Server certificate:
*  subject: OU=Domain Control Validated; CN=api.telegram.org
*  start date: May  4 14:42:31 2018 GMT
*  expire date: May 23 16:17:38 2020 GMT
*  subjectAltName: host "api.telegram.org" matched cert's "api.telegram.org"
*  issuer: C=US; ST=Arizona; L=Scottsdale; O=GoDaddy.com, Inc.; OU=http://certs.godaddy.com/repository/; CN=Go Daddy Secure Certificate Authority - G2
*  SSL certificate verify ok.
> POST /bot990060833:I_CAN_SEND_YOU_THE_TOKEN/sendPhoto HTTP/1.1
> Host: api.telegram.org
> User-Agent: curl/7.66.0
> Accept: */*
> Content-Length: 251
> Content-Type: multipart/form-data; boundary=------------------------1a46b756a156e014
> 
* We are completely uploaded and fine
* Mark bundle as not supporting multiuse
< HTTP/1.1 401 Unauthorized
< Server: nginx/1.16.1
< Date: Tue, 07 Jan 2020 20:51:14 GMT
< Content-Type: application/json
< Content-Length: 58
< Connection: keep-alive
< Strict-Transport-Security: max-age=31536000; includeSubDomains; preload
< Access-Control-Allow-Origin: *
< Access-Control-Expose-Headers: Content-Length,Content-Type,Date,Server,Connection
< 
* Connection #0 to host api.telegram.org left intact
{"ok":false,"error_code":401,"description":"Unauthorized"}/

**Comment by angelbarrera92** [comment]
> So --network=host basically bypasses the gVisor's network stack and uses the host networking stack. Which is mostly the same as using runc and that's why this works. The bug is probably in netstack. That said I would need an API key so that I can reproduce this and look at the packet traces. Or alternatively if you can do a pcap of the request and provide the pcap that will work too.
> 
> I tried reproducing this locally with an HTTPS nodejs server and I couldn't reproduce it. The connection terminates gracefully.

I can send you the token:

`AAHNw9NRcUILCl2k0ms0nefJv4P-F3cftLA`

But, if you receives *(without the real token)*: ` {"ok":false,"error_code":401,"description":"Unauthorized"}` means it's working.

**Comment by angelbarrera92** [comment]
Uhhmmm another interesting data. I see you are generating a dummy file. With this dummy file the request works. 

As you saw, we download a dummy image from internet (https://www.google.com/images/branding/googlelogo/2x/googlelogo_color_92x30dp.png) and then we try to upload to the telegram API... using that image, `curl` fails.

*Tested with different images*

**Comment by hbhasker** [comment]
I just tried it and I am unable to reproduce the issue.

curl https://www.google.com/images/branding/googlelogo/2x/googlelogo_color_92x30dp.png --output googlelogo
_color_92x30dp.png
  % Total    % Received % Xferd  Average Speed   Time    Time     Time  Current
                                 Dload  Upload   Total   Spent    Left  Speed
100  3831  100  3831    0     0  20596      0 --:--:-- --:--:-- --:--:-- 20708
/ # curl -X POST "https://api.telegram.org/bot990060833:AAHNw9NRcUILCl2k0ms0nefJv4P-F3cftLA/sendPhoto" -F chat_id=334621642 -F photo="@googlelogo_color_92x30dp.png" --verbose
Note: Unnecessary use of -X or --request, POST is already inferred.
*   Trying 149.154.167.220:443...
* TCP_NODELAY set
* Connected to api.telegram.org (149.154.167.220) port 443 (#0)
* ALPN, offering h2
* ALPN, offering http/1.1
* successfully set certificate verify locations:
*   CAfile: /etc/ssl/certs/ca-certificates.crt
  CApath: none
* TLSv1.3 (OUT), TLS handshake, Client hello (1):
* TLSv1.3 (IN), TLS handshake, Server hello (2):
* TLSv1.2 (IN), TLS handshake, Certificate (11):
* TLSv1.2 (IN), TLS handshake, Server key exchange (12):
* TLSv1.2 (IN), TLS handshake, Server finished (14):
* TLSv1.2 (OUT), TLS handshake, Client key exchange (16):
* TLSv1.2 (OUT), TLS change cipher, Change cipher spec (1):
* TLSv1.2 (OUT), TLS handshake, Finished (20):
* TLSv1.2 (IN), TLS handshake, Finished (20):
* SSL connection using TLSv1.2 / ECDHE-RSA-AES128-GCM-SHA256
* ALPN, server accepted to use http/1.1
* Server certificate:
*  subject: OU=Domain Control Validated; CN=api.telegram.org
*  start date: May  4 14:42:31 2018 GMT
*  expire date: May 23 16:17:38 2020 GMT
*  subjectAltName: host "api.telegram.org" matched cert's "api.telegram.org"
*  issuer: C=US; ST=Arizona; L=Scottsdale; O=GoDaddy.com, Inc.; OU=http://certs.godaddy.com/repository/; CN=Go Daddy Secure Certificate Authority - G2
*  SSL certificate verify ok.
> POST /bot990060833:AAHNw9NRcUILCl2k0ms0nefJv4P-F3cftLA/sendPhoto HTTP/1.1
> Host: api.telegram.org
> User-Agent: curl/7.66.0
> Accept: */*
> Content-Length: 4142
> Content-Type: multipart/form-data; boundary=------------------------78a204f64e1b9fb5
> Expect: 100-continue
> 
* Mark bundle as not supporting multiuse
< HTTP/1.1 100 Continue
* We are completely uploaded and fine
* Mark bundle as not supporting multiuse
< HTTP/1.1 200 OK
< Server: nginx/1.16.1
< Date: Tue, 07 Jan 2020 21:43:52 GMT
< Content-Type: application/json
< Content-Length: 414
< Connection: keep-alive
< Strict-Transport-Security: max-age=31536000; includeSubDomains; preload
< Access-Control-Allow-Origin: *
< Access-Control-Allow-Methods: GET, POST, OPTIONS
< Access-Control-Expose-Headers: Content-Length,Content-Type,Date,Server,Connection
< 
* Connection #0 to host api.telegram.org left intact
{"ok":true,"result":{"message_id":10,"from":{"id":990060833,"is_bot":true,"first_name":"testk8spin","username":"k8spin_bot"},"chat":{"id":334621642,"first_name":"Pau","last_name":"Rosello","username":"paurosello","type":"private"},"date":1578433432,"photo":[{"file_id":"AgADBAADc7ExG3cuqFBNNuo6eQvUkN3VIBsABAEAAwIAA20AA87VAgABFgQ","file_unique_id":"AQAD3dUgGwAEztUCAAE","file_size":4066,"width":184,"height":60}]}}/ # dmesg
[   0.000000] Starting gVisor...
[   0.313556] Searching for needles in stacks...
[   0.424314] Reading process obituaries...
[   0.703601] Generating random numbers by fair dice roll...
[   0.851597] Daemonizing children...
[   1.299396] Feeding the init monster...
[   1.588205] Searching for socket adapter...
[   2.035712] Digging up root...
[   2.328246] Checking naughty and nice process list...
[   2.811294] Moving files to filing cabinet...
[   2.887128] Gathering forks...
[   3.237045] Ready!
/ #

**Comment by hbhasker** [comment]
Corresponding packet trace of the request

13:55:10.188091 IP 192.168.9.3.57833 > dns.google.domain: 14019+ A? api.telegram.org. (34)
13:55:10.188350 IP 192.168.9.3.57833 > dns.google.domain: 14019+ A? api.telegram.org. (34)
13:55:10.188636 IP 192.168.9.3.57833 > dns.google.domain: 14543+ AAAA? api.telegram.org. (34)
13:55:10.188858 IP 192.168.9.3.57833 > dns.google.domain: 14543+ AAAA? api.telegram.org. (34)
13:55:10.189406 IP dns.google.domain > 192.168.9.3.57833: 14019 1/0/0 A 149.154.167.220 (50)
13:55:10.189493 IP dns.google.domain > 192.168.9.3.57833: 14543 1/0/0 AAAA 2001:67c:4e8:f004::9 (62)
13:55:10.189507 IP dns.google.domain > 192.168.9.3.57833: 14019 1/0/0 A 149.154.167.220 (50)
13:55:10.189701 IP dns.google.domain > 192.168.9.3.57833: 14543 1/0/0 AAAA 2001:67c:4e8:f004::9 (62)
13:55:10.192771 IP 192.168.9.3.54906 > 149.154.167.220.https: Flags [S], seq 4181495198, win 29184, options [mss 1460,sackOK,TS val 311544582 ecr 0,nop,wscale 7], length 0
13:55:10.335148 IP 149.154.167.220.https > 192.168.9.3.54906: Flags [S.], seq 71362373, ack 4181495199, win 28960, options [mss 1398,sackOK,TS val 121331936 ecr 311544582,nop,wscale 10], length 0
13:55:10.335397 IP 192.168.9.3.54906 > 149.154.167.220.https: Flags [.], ack 1, win 228, options [nop,nop,TS val 311544725 ecr 121331936], length 0
13:55:10.436964 IP 192.168.9.3.54906 > 149.154.167.220.https: Flags [P.], seq 1:518, ack 1, win 8192, options [nop,nop,TS val 311544826 ecr 121331936], length 517
13:55:10.579084 IP 149.154.167.220.https > 192.168.9.3.54906: Flags [.], ack 518, win 30, options [nop,nop,TS val 121331997 ecr 311544826], length 0
13:55:10.580435 IP 149.154.167.220.https > 192.168.9.3.54906: Flags [.], seq 1:2773, ack 518, win 30, options [nop,nop,TS val 121331997 ecr 311544826], length 2772
13:55:10.580564 IP 149.154.167.220.https > 192.168.9.3.54906: Flags [P.], seq 2773:4097, ack 518, win 30, options [nop,nop,TS val 121331997 ecr 311544826], length 1324
13:55:10.580711 IP 192.168.9.3.54906 > 149.154.167.220.https: Flags [.], ack 4097, win 8160, options [nop,nop,TS val 311544970 ecr 121331997], length 0
13:55:10.581551 IP 149.154.167.220.https > 192.168.9.3.54906: Flags [P.], seq 4097:5602, ack 518, win 30, options [nop,nop,TS val 121331997 ecr 311544826], length 1505
13:55:10.581747 IP 192.168.9.3.54906 > 149.154.167.220.https: Flags [.], ack 5602, win 8150, options [nop,nop,TS val 311544971 ecr 121331997], length 0
13:55:10.586661 IP 192.168.9.3.54906 > 149.154.167.220.https: Flags [P.], seq 518:611, ack 5602, win 8192, options [nop,nop,TS val 311544976 ecr 121331997], length 93
13:55:10.729002 IP 149.154.167.220.https > 192.168.9.3.54906: Flags [P.], seq 5602:5653, ack 611, win 30, options [nop,nop,TS val 121332034 ecr 311544976], length 51
13:55:10.729305 IP 192.168.9.3.54906 > 149.154.167.220.https: Flags [.], ack 5653, win 8191, options [nop,nop,TS val 311545119 ecr 121332034], length 0
13:55:10.733301 IP 192.168.9.3.54906 > 149.154.167.220.https: Flags [P.], seq 611:909, ack 5653, win 8192, options [nop,nop,TS val 311545123 ecr 121332034], length 298
13:55:10.875435 IP 149.154.167.220.https > 192.168.9.3.54906: Flags [P.], seq 5653:5707, ack 909, win 31, options [nop,nop,TS val 121332071 ecr 311545123], length 54
13:55:10.875687 IP 192.168.9.3.54906 > 149.154.167.220.https: Flags [.], ack 5707, win 8191, options [nop,nop,TS val 311545265 ecr 121332071], length 0
13:55:10.877504 IP 192.168.9.3.54906 > 149.154.167.220.https: Flags [P.], seq 909:5080, ack 5707, win 8192, options [nop,nop,TS val 311545267 ecr 121332071], length 4171
13:55:11.019800 IP 149.154.167.220.https > 192.168.9.3.54906: Flags [.], ack 5080, win 39, options [nop,nop,TS val 121332107 ecr 311545267], length 0
13:55:11.059923 IP 149.154.167.220.https > 192.168.9.3.54906: Flags [P.], seq 5707:6543, ack 5080, win 39, options [nop,nop,TS val 121332117 ecr 311545267], length 836
13:55:11.060144 IP 192.168.9.3.54906 > 149.154.167.220.https: Flags [.], ack 6543, win 8185, options [nop,nop,TS val 311545450 ecr 121332117], length 0
13:55:11.064977 IP 192.168.9.3.54906 > 149.154.167.220.https: Flags [P.], seq 5080:5111, ack 6543, win 8192, options [nop,nop,TS val 311545454 ecr 121332117], length 31
13:55:11.067931 IP 192.168.9.3.54906 > 149.154.167.220.https: Flags [F.], seq 5111, ack 6543, win 8192, options [nop,nop,TS val 311545457 ecr 121332117], length 0
13:55:11.207206 IP 149.154.167.220.https > 192.168.9.3.54906: Flags [F.], seq 6543, ack 5111, win 39, options [nop,nop,TS val 121332154 ecr 311545454], length 0
13:55:11.207475 IP 192.168.9.3.54906 > 149.154.167.220.https: Flags [.], ack 6544, win 8192, options [nop,nop,TS val 311545597 ecr 121332117], length 0
13:55:11.210055 IP 149.154.167.220.https > 192.168.9.3.54906: Flags [.], ack 5112, win 39, options [nop,nop,TS val 121332155 ecr 311545457], length 0

**Comment by angelbarrera92** [comment]
Attached the pcap ;) 
*(rename it back to .pcap instead of pcap.txt, github limitation)*

[telegram.pcap.txt](https://github.com/google/gvisor/files/4034056/telegram.pcap.txt)

**Comment by angelbarrera92** [comment]
Attached new pcap's files. Now from eth0 (main nic).

I tried this time with ubuntu instead of alpine, same error/behavior.

Ok (docker without runsc, gke node with gke sandbox): [eth0.telegram.ok.pcap.txt](https://github.com/google/gvisor/files/4036412/eth0.telegram.ok.pcap.txt)
Ko (docker with runsc, gke node with gke sandbox): [eth0.telegram.ko.pcap.txt](https://github.com/google/gvisor/files/4036413/eth0.telegram.ko.pcap.txt)


Commands: 
```bash
root@503f51d84460:/# history
    1  apt-get update && apt-get install -y curl
    2  curl https://www.google.com/images/branding/googlelogo/2x/googlelogo_color_92x30dp.png --output googlelogo_color_92x30dp.png
    3  curl -X POST "https://api.telegram.org/bot990060833:I_CAN_SEND_YOU_THE_TOKEN/sendPhoto" -F chat_id=334621642 -F photo="@googlelogo_color_92x30dp.png" --verbose
```

Dumped using: `tcpdump -s 0 -i eth0 -w telegram.ok.pcap` and `tcpdump -s 0 -i eth0 -w telegram.ko.pcap`

Thanks!

**Comment by angelbarrera92** [comment]
Attached new pcap's files. Now without gso

```bash
cat /etc/docker/daemon.json
{
    "live-restore": true,
    "runtimes": {
        "runsc": {
            "path": "/home/containerd/usr/local/sbin/runsc",
            "runtimeArgs": [
                "--gso=false", "--software-gso=false"
            ]
        }
    },
    "storage-driver": "overlay2"
}
```

(rename it back to .pcap instead of pcap.txt, github limitation)
Ko (docker with runsc, gke node with gke sandbox, eth0): [telegram.eth0.runsc.gso.ko.pcap.txt](https://github.com/google/gvisor/files/4036674/telegram.eth0.runsc.gso.ko.pcap.txt)

Ko (docker with runsc, gke node with gke sandbox, docker0): [telegram.docker0.runsc.gso.ko.pcap.txt](https://github.com/google/gvisor/files/4036678/telegram.docker0.runsc.gso.ko.pcap.txt)

Commands:

```bash
oot@0309fda06eb1:/# history
    1  apt-get update -y
    2  apt-get install -y curl
    3  curl https://www.google.com/images/branding/googlelogo/2x/googlelogo_color_92x30dp.png --output googlelogo_color_92x30dp.png
    4  curl -X POST "https://api.telegram.org/bot990060833:I_CAN_SEND_YOU_THE_TOKEN/sendPhoto" -F chat_id=334621642 -F photo="@googlelogo_color_92x30dp.png" --verbose
    5  history
```

**Comment by hbhasker** [comment]
Just to close the loop after much debugging I believe the issue is due to lack of PathMTU discovery in gVisor. 

The docker0 interface had an MTU of 1500 while the GCP VM nic has an MTU of 1460. This was causing IP fragmentation when packets were being sent when running inside gVisor. Which in turn was causing the remote end to send a RST ( unclear why it was causing a RST, I would have expected it to just lower the payload and carry on ).

The solution was to lower the MTU of docker0 to 1400 (I believe 1460 would work as well). 

While PathMTU is on our list of things to fix its not prioritized yet. I believe this provides another data point to add it *soon*. 

Marking the bug as closed as lowering the MTU seems to fix the issue and ideally GKE node setups can just set the MTU's correctly for docker0 and container nics.

**Comment by angelbarrera92** [comment]
> Marking the bug as closed as lowering the MTU seems to fix the issue and ideally GKE node setups can just set the MTU's correctly for docker0 and container nics.

I will open a google cloud ticket with this information. Thank you gvisor team!

**Comment by angelbarrera92** [comment]
> > Marking the bug as closed as lowering the MTU seems to fix the issue and ideally GKE node setups can just set the MTU's correctly for docker0 and container nics.
> 
> I will open a google cloud ticket with this information. Thank you gvisor team!

I am unable to do it 😭

**Comment by fvoznika** [comment]
Let's keep this issue open as this problem is not exclusive to GKE. @angelbarrera92 you can continue to follow up on progress here.

**Comment by fvoznika** [comment]
@angelbarrera92, what node version are you running `kubectl get nodes`?

I'm running `v1.15.4-gke.22` which has the same `runsc` version you are using. In my case I see that docker0 network is configured [wrongly] with `MTU=1500`, however Kubernetes configures the network correctly with `MTU=1460` which matches the host.

Could you please run a gVisor pod, then ssh to the node and paste the result of `ip link`?

This is what I see:
* device 2 is the host
* device 9 is for a k8s pod running gVisor (works)
* device 13 is for a docker container running gVisor (fails)

```
2: eth0: <BROADCAST,MULTICAST,UP,LOWER_UP> mtu 1460 qdisc pfifo_fast state UP mode DEFAULT group default qlen 1000
    link/ether 42:01:0a:8a:0f:e2 brd ff:ff:ff:ff:ff:ff
9: veth20bc4f8f@if3: <BROADCAST,MULTICAST,UP,LOWER_UP> mtu 1460 qdisc noqueue state UP mode DEFAULT group default 
    link/ether de:a0:f5:9f:4b:a2 brd ff:ff:ff:ff:ff:ff link-netnsid 0
13: veth8570b50@if12: <BROADCAST,MULTICAST,UP,LOWER_UP> mtu 1500 qdisc noqueue master docker0 state UP mode DEFAULT group default 
    link/ether e2:4e:ae:be:2c:b5 brd ff:ff:ff:ff:ff:ff link-netnsid 1
```

**Comment by angelbarrera92** [comment]
> @angelbarrera92, what node version are you running `kubectl get nodes`?
> 
> I'm running `v1.15.4-gke.22` which has the same `runsc` version you are using. In my case I see that docker0 network is configured [wrongly] with `MTU=1500`, however Kubernetes configures the network correctly with `MTU=1460` which matches the host.
> 
> Could you please run a gVisor pod, then ssh to the node and paste the result of `ip link`?
> 
> This is what I see:
> 
>     * device 2 is the host
> 
>     * device 9 is for a k8s pod running gVisor (works)
> 
>     * device 13 is for a docker container running gVisor (fails)
> 
> 
> ```
> 2: eth0: <BROADCAST,MULTICAST,UP,LOWER_UP> mtu 1460 qdisc pfifo_fast state UP mode DEFAULT group default qlen 1000
>     link/ether 42:01:0a:8a:0f:e2 brd ff:ff:ff:ff:ff:ff
> 9: veth20bc4f8f@if3: <BROADCAST,MULTICAST,UP,LOWER_UP> mtu 1460 qdisc noqueue state UP mode DEFAULT group default 
>     link/ether de:a0:f5:9f:4b:a2 brd ff:ff:ff:ff:ff:ff link-netnsid 0
> 13: veth8570b50@if12: <BROADCAST,MULTICAST,UP,LOWER_UP> mtu 1500 qdisc noqueue master docker0 state UP mode DEFAULT group default 
>     link/ether e2:4e:ae:be:2c:b5 brd ff:ff:ff:ff:ff:ff link-netnsid 1
> ```

I am running same version as you are (latest available).
I see some differents... i am running calico, (network policy gke feature). Did you enabled the network policy feature in your cluster?

`ifconfing` truncated output (not all network interfaces) from a gvisor enable node.
```
calie80a452974c: flags=4163<UP,BROADCAST,RUNNING,MULTICAST>  mtu 1500
        inet6 fe80::ecee:eeff:feee:eeee  prefixlen 64  scopeid 0x20<link>
        ether ee:ee:ee:ee:ee:ee  txqueuelen 0  (Ethernet)
        RX packets 40829  bytes 5442429 (5.1 MiB)
        RX errors 0  dropped 0  overruns 0  frame 0
        TX packets 29755  bytes 14678849 (13.9 MiB)
        TX errors 0  dropped 0 overruns 0  carrier 0  collisions 0
calif4b9ca8c08b: flags=4163<UP,BROADCAST,RUNNING,MULTICAST>  mtu 1500
        inet6 fe80::ecee:eeff:feee:eeee  prefixlen 64  scopeid 0x20<link>
        ether ee:ee:ee:ee:ee:ee  txqueuelen 0  (Ethernet)
        RX packets 26  bytes 1916 (1.8 KiB)
        RX errors 0  dropped 2  overruns 0  frame 0
        TX packets 32  bytes 2558 (2.4 KiB)
        TX errors 0  dropped 0 overruns 0  carrier 0  collisions 0
docker0: flags=4099<UP,BROADCAST,MULTICAST>  mtu 1500
        inet 172.17.0.1  netmask 255.255.0.0  broadcast 172.17.255.255
        ether 02:42:27:fe:dc:62  txqueuelen 0  (Ethernet)
        RX packets 0  bytes 0 (0.0 B)
        RX errors 0  dropped 0  overruns 0  frame 0
        TX packets 0  bytes 0 (0.0 B)
        TX errors 0  dropped 0 overruns 0  carrier 0  collisions 0
eth0: flags=4163<UP,BROADCAST,RUNNING,MULTICAST>  mtu 1460
        inet 10.100.0.84  netmask 255.255.255.255  broadcast 0.0.0.0
        inet6 fe80::4001:aff:fe64:54  prefixlen 64  scopeid 0x20<link>
        ether 42:01:0a:64:00:54  txqueuelen 1000  (Ethernet)
        RX packets 621240  bytes 1251078892 (1.1 GiB)
        RX errors 0  dropped 0  overruns 0  frame 0
        TX packets 540837  bytes 174258124 (166.1 MiB)
        TX errors 0  dropped 0 overruns 0  carrier 0  collisions 0
lo: flags=73<UP,LOOPBACK,RUNNING>  mtu 65536
        inet 127.0.0.1  netmask 255.0.0.0
        inet6 ::1  prefixlen 128  scopeid 0x10<host>
        loop  txqueuelen 1000  (Local Loopback)
        RX packets 161032  bytes 12027955 (11.4 MiB)
        RX errors 0  dropped 0  overruns 0  frame 0
        TX packets 161032  bytes 12027955 (11.4 MiB)
        TX errors 0  dropped 0 overruns 0  carrier 0  collisions 0
```

As you can see, docker0 and every calico nic has a wrong MTU setup.

**Comment by fvoznika** [comment]
Calico has a configuration setting for MTU size and it's set to 1460 in GKE. However, a bug in the code makes the setting be ignored. So there is no way to tell Calico to use a different MTU value. The Calico team is working on a fix.

As for docker, it [intentionally ignores the host's MTU](https://github.com/moby/moby/pull/18108) and sets to 1500 by default. It can be changed by passing the `--mtu` flag to `dockerd`.

On the other hand, CNI does mirror the host network MTU in the veth. @angelbarrera92, is it an option for you to disable Calico for now as a workaround?

**Comment by angelbarrera92** [comment]
> Calico has a configuration setting for MTU size and it's set to 1460 in GKE. However, a bug in the code makes the setting be ignored. So there is no way to tell Calico to use a different MTU value. The Calico team is working on a fix.
> 
> As for docker, it [intentionally ignores the host's MTU](https://github.com/moby/moby/pull/18108) and sets to 1500 by default. It can be changed by passing the `--mtu` flag to `dockerd`.
> 
> On the other hand, CNI does mirror the host network MTU in the veth. @angelbarrera92, is it an option for you to disable Calico for now as a workaround?

Hi @fvoznika!

Understood docker behavior, i don't fully understand what is the Calico bug. Is there any open issue i can track?
I found some interesting links related with MTU, Calico and GKE: https://github.com/kubernetes/kubernetes/issues/65067 (quite old), https://github.com/kubernetes/kubernetes/pull/65024 ...

What if GKE configures statically the MTU value? 
--------

**MTU configuration with CNI**
MTU is set in the by the "mtu": <MTU size> field of the CNI configuration. Example:

```json
  {
    "name": "any_name",
    "cniVersion": "0.1.0",
    "type": "calico",
    "mtu": 1480,
    "ipam": {
      "type": "calico-ipam"
    }
  }
```

> Note: If using Kubernetes self-hosted manifests, you should modify the veth_mtu value in the  Calico ConfigMap instead, and leave "mtu" here set to __CNI_MTU__. See below for more details.

--------
_Source:_ https://docs.projectcalico.org/v3.5/usage/configuration/mtu

About disabling Calico... our workloads uses network policies (as we are offering a SaaS Kubernetes Service) so we disable Calico, but we have to install another CNI plugin providing NetworkPolicies.

I am thinking in moving from Calico to Cilium as it provides Network Policies: https://docs.cilium.io/en/stable/gettingstarted/k8s-install-gke/

But we are not sure if Cilium + gVisor will work (not tested)

**Comment by fvoznika** [comment]
@angelbarrera92 the bug is in the way GKE configures Calico (not in Calico itself, sorry for the confusion). The MTU configuration is done in the master but it's not propagated correctly to the node.

Since you may not be able to move away from Calico, you can change CNI configuration in `/etc/cni/net.d/10-calico.conflist` to add `"mtu": 1460`. The caveat is that the configuration is overwritten every time the node is restarted, and any pod created will use MTU 1500 until the configuration is changed again:

```json
{
  "name": "k8s-pod-network",
  "cniVersion": "0.3.1",
  "plugins": [
    {
      "type": "calico",
      "mtu": 1460,
      "log_level": "warning",
      "datastore_type": "kubernetes",
      "..."
```

**Comment by angelbarrera92** [comment]
> @angelbarrera92 the bug is in the way GKE configures Calico (not in Calico itself, sorry for the confusion). The MTU configuration is done in the master but it's not propagated correctly to the node.
> 
> Since you may not be able to move away from Calico, you can change CNI configuration in `/etc/cni/net.d/10-calico.conflist` to add `"mtu": 1460`. The caveat is that the configuration is overwritten every time the node is restarted, and any pod created will use MTU 1500 until the configuration is changed again:
> 
> ```json
> {
>   "name": "k8s-pod-network",
>   "cniVersion": "0.3.1",
>   "plugins": [
>     {
>       "type": "calico",
>       "mtu": 1460,
>       "log_level": "warning",
>       "datastore_type": "kubernetes",
>       "..."
> ```
> 
> Please let me know if this works for you.

Understood now.

But i think this is not a real option. We have some node_pools using preemptible nodes... 
Maybe something like a daemon-set applying the correct configuration on every node... But i am not sure if it will work.

Another alternative is to deactivate the network-policy feature from GKE and install cilium (not an option right now due to another issue in GKE: https://github.com/cilium/cilium/issues/9556) or calico (by our selfs).

**Comment by angelbarrera92** [comment]
> @angelbarrera92 the bug is in the way GKE configures Calico (not in Calico itself, sorry for the confusion). The MTU configuration is done in the master but it's not propagated correctly to the node.
> 
> Since you may not be able to move away from Calico, you can change CNI configuration in `/etc/cni/net.d/10-calico.conflist` to add `"mtu": 1460`. The caveat is that the configuration is overwritten every time the node is restarted, and any pod created will use MTU 1500 until the configuration is changed again:
> 
> ```json
> {
>   "name": "k8s-pod-network",
>   "cniVersion": "0.3.1",
>   "plugins": [
>     {
>       "type": "calico",
>       "mtu": 1460,
>       "log_level": "warning",
>       "datastore_type": "kubernetes",
>       "..."
> ```
> 
> Please let me know if this works for you.

Hi again @fvoznika, following your indications (as cilium and own calico installation did not work), we moved to your proposed solution, configuring MTU using a daemonset. We have created a repository with the code here: https://github.com/k8spin/calico-node-mtu-setup if you want to take a look ;)

We tested it in our dev environment and it worked as expected ;) we plan to move it to the production environment.

The question now is... When is going to be fixed by GKE team?

Thanks!

**Comment by fvoznika** [comment]
The estimate for the fix is to be available in production is early February.

**Comment by angelbarrera92** [comment]
> The estimate for the fix is to be available in production is early February.

We have deployed it in our prod environment. Everything is working now :).

**Comment by joestringer** [comment]
FYI the Cilium issue mentioned above with GKE beta is resolved.

**Comment by angelbarrera92** [comment]
> FYI the Cilium issue mentioned above with GKE beta is resolved and will be part of the upcoming v1.6.6 release.

Too late bad good to know. A production cluster was affected by this issue. 

Thanks!!!

**Comment by fvoznika** [comment]
The fix is live now with GKE 1.15.7-gke.23 or greater.
