### ISSUE TITLE
Operation timed out when using iperf3

### ISSUE THREAD

**Issue by ustiugov** [google/gvisor#195]
Hi everyone,

I am experiencing a connectivity problem when using iperf3. I am booting a docker container with the following cmd:
`docker run -dit --name alpine1 --runtime=runsc -p 52022:22 -p 42022:5201 alpine ash`

After configuring SSH and few other things, I am able to SSH into the container from the remote machine, no problem. However, when I start an iperf3 server inside that container and try to run the client on a remote host, it just hangs and timeouts.

From the client side I cannot see any output:
`iperf3 -c 10.90.36.40 -p 42022 -V`

From the server side, I see: 
```
 iperf3 -s

-----------------------------------------------------------

Server listening on 5201

-----------------------------------------------------------

iperf3: error - unable to receive parameters from client: Operation timed out
```

This exact setup works perfectly with the default docker runtime.

Host system:
4.15.0-47-generic #50-Ubuntu SMP Wed Mar 13 10:44:52 UTC 2019 x86_64 x86_64 x86_64 GNU/Linux
Docker version 18.09.2, build 6247962
runsc version release-20190304.1-112-g4209edafb6a9, spec: 1.0.1-dev
iperf 3.0.11

**Comment by hbhasker** [comment]
Thanks for the bug report. I captured a packet trace from inside the sandbox and outside and what I see is that for some reason the connection is getting hung with both sides acking each other but connection not progressing.

From inside sandbox.

I0412 14:22:48.372866       1 x:0] recv tcp 172.17.0.1:46206 -> 172.17.0.2:5201 len:0 id:b29c flags:0x02 ( S    ) seqnum: 1357107984 ack: 0 win: 29200 xsum:0x5854 options: {MSS:1460 WS:7 TS:true TSVal:2806761413 TSEcr:0 SACKPermitted:true}
I0412 14:22:48.373785       1 x:0] send tcp 172.17.0.2:5201 -> 172.17.0.1:46206 len:0 id:0000 flags:0x12 ( S  A ) seqnum: 3134876341 ack: 1357107985 win: 65535 xsum:0x68e0 options: {MSS:1460 WS:7 TS:true TSVal:1130218022 TSEcr:2806761413 SACKPermitted:true}
14:22:48.374017 IP (tos 0x0, ttl 64, id 45725, offset 0, flags [DF], proto TCP (6), length 52)
    172.17.0.1.46206 > 172.17.0.2.5201: Flags [.], cksum 0x584c (incorrect -> 0x96c6), seq 1, ack 1, win 229, options [nop,nop,TS val 2806761414 ecr 1130218022], length 0
14:22:48.374125 IP (tos 0x0, ttl 64, id 45726, offset 0, flags [DF], proto TCP (6), length 89)
    172.17.0.1.46206 > 172.17.0.2.5201: Flags [P.], cksum 0x5871 (incorrect -> 0xbe6f), seq 1:38, ack 1, win 229, options [nop,nop,TS val 2806761414 ecr 1130218022], length 37
I0412 14:22:48.374358       1 x:0] recv tcp 172.17.0.1:46206 -> 172.17.0.2:5201 len:0 id:b29d flags:0x10 (    A ) seqnum: 1357107985 ack: 3134876342 win: 229 xsum:0x584c options: {TS:true TSVal:2806761414 TSEcr:1130218022 SACKBlocks:[]}
I0412 14:22:48.374482       1 x:0] recv tcp 172.17.0.1:46206 -> 172.17.0.2:5201 len:37 id:b29e flags:0x18 (   PA ) seqnum: 1357107985 ack: 3134876342 win: 229 xsum:0x5871 options: {TS:true TSVal:2806761414 TSEcr:1130218022 SACKBlocks:[]}
I0412 14:22:48.374884       1 x:0] send tcp 172.17.0.2:5201 -> 172.17.0.1:46206 len:0 id:0000 flags:0x10 (    A ) seqnum: 3134876342 ack: 1357108022 win: 0 xsum:0x9785 options: {TS:true TSVal:1130218023 TSEcr:2806761414 SACKBlocks:[]}
I0412 14:22:48.375037       1 x:0] send tcp 172.17.0.2:5201 -> 172.17.0.1:46206 len:1 id:0000 flags:0x18 (   PA ) seqnum: 3134876342 ack: 1357108022 win: 0 xsum:0x8e7b options: {TS:true TSVal:1130218024 TSEcr:2806761414 SACKBlocks:[]}
I0412 14:22:48.375169       1 x:0] recv tcp 172.17.0.1:46206 -> 172.17.0.2:5201 len:0 id:b29f flags:0x10 (    A ) seqnum: 1357108022 ack: 3134876343 win: 229 xsum:0x584c options: {TS:true TSVal:2806761415 TSEcr:1130218024 SACKBlocks:[]}
I0412 14:22:48.580063       1 x:0] recv tcp 172.17.0.1:46206 -> 172.17.0.2:5201 len:0 id:b2a0 flags:0x10 (    A ) seqnum: 1357108021 ack: 3134876343 win: 229 xsum:0x584c options: {TS:true TSVal:2806761620 TSEcr:1130218024 SACKBlocks:[]}
I0412 14:22:48.580466       1 x:0] send tcp 172.17.0.2:5201 -> 172.17.0.1:46206 len:0 id:0000 flags:0x10 (    A ) seqnum: 3134876343 ack: 1357108022 win: 0 xsum:0x96b5 options: {TS:true TSVal:1130218229 TSEcr:2806761415 SACKBlocks:[]}
I0412 14:22:48.996087       1 x:0] recv tcp 172.17.0.1:46206 -> 172.17.0.2:5201 len:0 id:b2a1 flags:0x10 (    A ) seqnum: 1357108021 ack: 3134876343 win: 229 xsum:0x584c options: {TS:true TSVal:2806762036 TSEcr:1130218229 SACKBlocks:[]}
I0412 14:22:48.996437       1 x:0] send tcp 172.17.0.2:5201 -> 172.17.0.1:46206 len:0 id:0000 flags:0x10 (    A ) seqnum: 3134876343 ack: 1357108022 win: 0 xsum:0x9448 options: {TS:true TSVal:1130218645 TSEcr:2806761620 SACKBlocks:[]}
I0412 14:22:49.827961       1 x:0] recv tcp 172.17.0.1:46206 -> 172.17.0.2:5201 len:0 id:b2a2 flags:0x10 (    A ) seqnum: 1357108021 ack: 3134876343 win: 229 xsum:0x584c options: {TS:true TSVal:2806762868 TSEcr:1130218645 SACKBlocks:[]}
I0412 14:22:49.828281       1 x:0] send tcp 172.17.0.2:5201 -> 172.17.0.1:46206 len:0 id:0000 flags:0x10 (    A ) seqnum: 3134876343 ack: 1357108022 win: 0 xsum:0x8f68 options: {TS:true TSVal:1130219477 TSEcr:2806762036 SACKBlocks:[]}
I0412 14:22:51.491893       1 x:0] recv tcp 172.17.0.1:46206 -> 172.17.0.2:5201 len:0 id:b2a3 flags:0x10 (    A ) seqnum: 1357108021 ack: 3134876343 win: 229 xsum:0x584c options: {TS:true TSVal:2806764531 TSEcr:1130219477 SACKBlocks:[]}
I0412 14:22:51.492268       1 x:0] send tcp 172.17.0.2:5201 -> 172.17.0.1:46206 len:0 id:0000 flags:0x10 (    A ) seqnum: 3134876343 ack: 1357108022 win: 0 xsum:0x85a8 options: {TS:true TSVal:1130221141 TSEcr:2806762868 SACKBlocks:[]}
I0412 14:22:54.979980       1 x:0] recv tcp 172.17.0.1:46206 -> 172.17.0.2:5201 len:0 id:b2a4 flags:0x10 (    A ) seqnum: 1357108021 ack: 3134876343 win: 229 xsum:0x584c options: {TS:true TSVal:2806768019 TSEcr:1130221141 SACKBlocks:[]}
I0412 14:22:54.980271       1 x:0] send tcp 172.17.0.2:5201 -> 172.17.0.1:46206 len:0 id:0000 flags:0x10 (    A ) seqnum: 3134876343 ack: 1357108022 win: 0 xsum:0x7189 options: {TS:true TSVal:1130224629 TSEcr:2806764531 SACKBlocks:[]}
I0412 14:23:01.635978       1 x:0] recv tcp 172.17.0.1:46206 -> 172.17.0.2:5201 len:0 id:b2a5 flags:0x10 (    A ) seqnum: 1357108021 ack: 3134876343 win: 229 xsum:0x584c options: {TS:true TSVal:2806774675 TSEcr:1130224629 SACKBlocks:[]}
I0412 14:23:01.636318       1 x:0] send tcp 172.17.0.2:5201 -> 172.17.0.1:46206 len:0 id:0000 flags:0x10 (    A ) seqnum: 3134876343 ack: 1357108022 win: 0 xsum:0x49e9 options: {TS:true TSVal:1130231285 TSEcr:2806768019 SACKBlocks:[]}
I0412 14:23:12.130201       1 x:0] Watchdog starting loop, tasks: 2, discount: 0s
I0412 14:23:14.948007       1 x:0] recv tcp 172.17.0.1:46206 -> 172.17.0.2:5201 len:0 id:b2a6 flags:0x10 (    A ) seqnum: 1357108021 ack: 3134876343 win: 229 xsum:0x584c options: {TS:true TSVal:2806787985 TSEcr:1130231285 SACKBlocks:[]}
I0412 14:23:14.948297       1 x:0] send tcp 172.17.0.2:5201 -> 172.17.0.1:46206 len:0 id:0000 flags:0x10 (    A ) seqnum: 3134876343 ack: 1357108022 win: 0 xsum:0xfbe8 options: {TS:true TSVal:1130244597 TSEcr:2806774675 SACKBlocks:[]}
I0412 14:23:19.555882       1 x:0] recv icmp fe80::42:9eff:fe16:8385 -> ff02::2 router solicit len:16 id:0000 code:0
I0412 14:23:42.084120       1 x:0] recv tcp 172.17.0.1:46206 -> 172.17.0.2:5201 len:0 id:b2a7 flags:0x10 (    A ) seqnum: 1357108021 ack: 3134876343 win: 229 xsum:0x584c options: {TS:true TSVal:2806815119 TSEcr:1130244597 SACKBlocks:[]}
I0412 14:23:42.084550       1 x:0] send tcp 172.17.0.2:5201 -> 172.17.0.1:46206 len:0 id:0000 flags:0x10 (    A ) seqnum: 3134876343 ack: 1357108022 win: 0 xsum:0x5dea options: {TS:true TSVal:1130271733 TSEcr:2806787985 SACKBlocks:[]}
I0412 14:23:47.203927       1 x:0] recv arp 172.17.0.1 (02:42:9e:16:83:85) -> 172.17.0.2 (00:00:00:00:00:00) valid:true
I0412 14:23:47.204201       1 x:0] send arp 172.17.0.2 (a6:20:bd:5c:36:8d) -> 172.17.0.1 (00:00:00:00:00:00) valid:true


From outside

I0412 14:22:48.372866       1 x:0] recv tcp 172.17.0.1:46206 -> 172.17.0.2:5201 len:0 id:b29c flags:0x02 ( S    ) seqnum: 1357107984 ack: 0 win: 29200 xsum:0x5854 options: {MSS:1460 WS:7 TS:true TSVal:2806761413 TSEcr:0 SACKPermitted:true}
I0412 14:22:48.373785       1 x:0] send tcp 172.17.0.2:5201 -> 172.17.0.1:46206 len:0 id:0000 flags:0x12 ( S  A ) seqnum: 3134876341 ack: 1357107985 win: 65535 xsum:0x68e0 options: {MSS:1460 WS:7 TS:true TSVal:1130218022 TSEcr:2806761413 SACKPermitted:true}
14:22:48.374017 IP (tos 0x0, ttl 64, id 45725, offset 0, flags [DF], proto TCP (6), length 52)
    172.17.0.1.46206 > 172.17.0.2.5201: Flags [.], cksum 0x584c (incorrect -> 0x96c6), seq 1, ack 1, win 229, options [nop,nop,TS val 2806761414 ecr 1130218022], length 0
14:22:48.374125 IP (tos 0x0, ttl 64, id 45726, offset 0, flags [DF], proto TCP (6), length 89)
    172.17.0.1.46206 > 172.17.0.2.5201: Flags [P.], cksum 0x5871 (incorrect -> 0xbe6f), seq 1:38, ack 1, win 229, options [nop,nop,TS val 2806761414 ecr 1130218022], length 37
14:22:48.374952 IP (tos 0x0, ttl 255, id 0, offset 0, flags [none], proto TCP (6), length 52)
    172.17.0.2.5201 > 172.17.0.1.46206: Flags [.], cksum 0x9785 (correct), seq 1, ack 38, win 0, options [nop,nop,TS val 1130218023 ecr 2806761414], length 0
14:22:48.375083 IP (tos 0x0, ttl 255, id 0, offset 0, flags [none], proto TCP (6), length 53)
    172.17.0.2.5201 > 172.17.0.1.46206: Flags [P.], cksum 0x8e7b (correct), seq 1:2, ack 38, win 0, options [nop,nop,TS val 1130218024 ecr 2806761414], length 1
14:22:48.375104 IP (tos 0x0, ttl 64, id 45727, offset 0, flags [DF], proto TCP (6), length 52)
    172.17.0.1.46206 > 172.17.0.2.5201: Flags [.], cksum 0x584c (incorrect -> 0x969d), seq 38, ack 2, win 229, options [nop,nop,TS val 2806761415 ecr 1130218024], length 0
14:22:48.579696 IP (tos 0x0, ttl 64, id 45728, offset 0, flags [DF], proto TCP (6), length 52)
    172.17.0.1.46206 > 172.17.0.2.5201: Flags [.], cksum 0x584c (incorrect -> 0x95d1), seq 37, ack 2, win 229, options [nop,nop,TS val 2806761620 ecr 1130218024], length 0
14:22:48.580558 IP (tos 0x0, ttl 255, id 0, offset 0, flags [none], proto TCP (6), length 52)
    172.17.0.2.5201 > 172.17.0.1.46206: Flags [.], cksum 0x96b5 (correct), seq 2, ack 38, win 0, options [nop,nop,TS val 1130218229 ecr 2806761415], length 0
14:22:48.995737 IP (tos 0x0, ttl 64, id 45729, offset 0, flags [DF], proto TCP (6), length 52)
    172.17.0.1.46206 > 172.17.0.2.5201: Flags [.], cksum 0x584c (incorrect -> 0x9364), seq 37, ack 2, win 229, options [nop,nop,TS val 2806762036 ecr 1130218229], length 0
14:22:48.996542 IP (tos 0x0, ttl 255, id 0, offset 0, flags [none], proto TCP (6), length 52)
    172.17.0.2.5201 > 172.17.0.1.46206: Flags [.], cksum 0x9448 (correct), seq 2, ack 38, win 0, options [nop,nop,TS val 1130218645 ecr 2806761620], length 0
14:22:49.827699 IP (tos 0x0, ttl 64, id 45730, offset 0, flags [DF], proto TCP (6), length 52)
    172.17.0.1.46206 > 172.17.0.2.5201: Flags [.], cksum 0x584c (incorrect -> 0x8e84), seq 37, ack 2, win 229, options [nop,nop,TS val 2806762868 ecr 1130218645], length 0
14:22:49.828418 IP (tos 0x0, ttl 255, id 0, offset 0, flags [none], proto TCP (6), length 52)
    172.17.0.2.5201 > 172.17.0.1.46206: Flags [.], cksum 0x8f68 (correct), seq 2, ack 38, win 0, options [nop,nop,TS val 1130219477 ecr 2806762036], length 0
14:22:51.491669 IP (tos 0x0, ttl 64, id 45731, offset 0, flags [DF], proto TCP (6), length 52)
    172.17.0.1.46206 > 172.17.0.2.5201: Flags [.], cksum 0x584c (incorrect -> 0x84c5), seq 37, ack 2, win 229, options [nop,nop,TS val 2806764531 ecr 1130219477], length 0
14:22:51.492418 IP (tos 0x0, ttl 255, id 0, offset 0, flags [none], proto TCP (6), length 52)
    172.17.0.2.5201 > 172.17.0.1.46206: Flags [.], cksum 0x85a8 (correct), seq 2, ack 38, win 0, options [nop,nop,TS val 1130221141 ecr 2806762868], length 0
14:22:54.979656 IP (tos 0x0, ttl 64, id 45732, offset 0, flags [DF], proto TCP (6), length 52)
    172.17.0.1.46206 > 172.17.0.2.5201: Flags [.], cksum 0x584c (incorrect -> 0x70a5), seq 37, ack 2, win 229, options [nop,nop,TS val 2806768019 ecr 1130221141], length 0
14:22:54.980384 IP (tos 0x0, ttl 255, id 0, offset 0, flags [none], proto TCP (6), length 52)
    172.17.0.2.5201 > 172.17.0.1.46206: Flags [.], cksum 0x7189 (correct), seq 2, ack 38, win 0, options [nop,nop,TS val 1130224629 ecr 2806764531], length 0
14:23:01.635651 IP (tos 0x0, ttl 64, id 45733, offset 0, flags [DF], proto TCP (6), length 52)
    172.17.0.1.46206 > 172.17.0.2.5201: Flags [.], cksum 0x584c (incorrect -> 0x4905), seq 37, ack 2, win 229, options [nop,nop,TS val 2806774675 ecr 1130224629], length 0
14:23:01.636440 IP (tos 0x0, ttl 255, id 0, offset 0, flags [none], proto TCP (6), length 52)
    172.17.0.2.5201 > 172.17.0.1.46206: Flags [.], cksum 0x49e9 (correct), seq 2, ack 38, win 0, options [nop,nop,TS val 1130231285 ecr 2806768019], length 0
14:23:14.947639 IP (tos 0x0, ttl 64, id 45734, offset 0, flags [DF], proto TCP (6), length 52)
    172.17.0.1.46206 > 172.17.0.2.5201: Flags [.], cksum 0x584c (incorrect -> 0xfb06), seq 37, ack 2, win 229, options [nop,nop,TS val 2806787985 ecr 1130231285], length 0
14:23:14.948386 IP (tos 0x0, ttl 255, id 0, offset 0, flags [none], proto TCP (6), length 52)
    172.17.0.2.5201 > 172.17.0.1.46206: Flags [.], cksum 0xfbe8 (correct), seq 2, ack 38, win 0, options [nop,nop,TS val 1130244597 ecr 2806774675], length 0
14:23:19.555658 IP6 (hlim 255, next-header ICMPv6 (58) payload length: 16) fe80::42:9eff:fe16:8385 > ip6-allrouters: [icmp6 sum ok] ICMP6, router solicitation, length 16
          source link-address option (1), length 8 (1): 02:42:9e:16:83:85

**Comment by hbhasker** [comment]
So I did more investigation. I think this is a bug in the iperf3 client from what I can see or something really odd is going on.

Here's an strace of what the client is doing. NOTE: After reading the 1 byte of '\t' it does two more writes to the same fd of 4 bytes then another one of 97 bytes which has the parameters for the connection.


connect(3, {sa_family=AF_INET, sin_port=htons(5201), sin_addr=inet_addr("172.17.0.2")}, 16) = 0
write(3, "gvisor-bench.1555120050.144773.5"..., 37) = 37
clock_gettime(CLOCK_PROCESS_CPUTIME_ID, {tv_sec=0, tv_nsec=4424445}) = 0
getrusage(RUSAGE_SELF, {ru_utime={tv_sec=0, tv_usec=4484}, ru_stime={tv_sec=0, tv_usec=0}, ...}) = 0
select(4, [3], [], NULL, NULL)          = 1 (in [3])
read(3, "\t", 1)                        = 1   <---- READ ONE byte from server
write(3, "\0\0\0a", 4)                  = 4        <---- WROTE 4
write(3, "{\"tcp\":true,\"omit\":0,\"time\":10,\""..., 97) = 97 <--- WROTE ANOTHER 97
open("/etc/localtime", O_RDONLY|O_CLOEXEC) = 4
fstat(4, {st_mode=S_IFREG|0644, st_size=127, ...}) = 0
fstat(4, {st_mode=S_IFREG|0644, st_size=127, ...}) = 0
read(4, "TZif2\0\0\0\0\0\0\0\0\0\0\0\0\0\0\0\0\0\0\1\0\0\0\1\0\0\0\0"..., 4096) = 127
lseek(4, -71, SEEK_CUR)                 = 56
read(4, "TZif2\0\0\0\0\0\0\0\0\0\0\0\0\0\0\0\0\0\0\1\0\0\0\1\0\0\0\0"..., 4096) = 71
close(4)                                = 0
write(1, "Time: Sat, 13 Apr 2019 01:47:30 "..., 36Time: Sat, 13 Apr 2019 01:47:30 GMT
) = 36
write(1, "Connecting to host 172.17.0.2, p"..., 41Connecting to host 172.17.0.2, port 5201
) = 41
write(1, "Reverse mode, remote host 172.17"..., 48Reverse mode, remote host 172.17.0.2 is sending
) = 48
write(1, "      Cookie: gvisor-bench.15551"..., 51      Cookie: gvisor-bench.1555120050.144773.59377
) = 51
getsockopt(3, SOL_TCP, TCP_MAXSEG, [1448], [4]) = 0
write(1, "      TCP MSS: 1448 (default)\n", 30      TCP MSS: 1448 (default)
) = 30

But the packet trace for the same device does not show the writes.

See: After the 1 byte \t is read and acked no packets are going out from the client at all. All further packets are just ACK's being exchanged. I will see if I can figure out from iperf3 client code what could be going on.

01:47:30.145516 IP (tos 0x0, ttl 64, id 30644, offset 0, flags [DF], proto TCP (6), length 60)
    172.17.0.1.49804 > 172.17.0.2.5201: Flags [S], cksum 0x5854 (incorrect -> 0x1cf7), seq 3689246659, win 29200, options [mss 1460,sackOK,TS val 2847839373 ecr 0,nop,wscale 7], length 0
01:47:30.146410 IP (tos 0x0, ttl 255, id 0, offset 0, flags [none], proto TCP (6), length 60)
    172.17.0.2.5201 > 172.17.0.1.49804: Flags [S.], cksum 0x11e7 (correct), seq 3279892257, ack 3689246660, win 65535, options [mss 1460,sackOK,TS val 2450258018 ecr 2847839373,nop,wscale 7], length 0
01:47:30.146481 IP (tos 0x0, ttl 64, id 30645, offset 0, flags [DF], proto TCP (6), length 52)
    172.17.0.1.49804 > 172.17.0.2.5201: Flags [.], cksum 0x584c (incorrect -> 0x3fcd), seq 1, ack 1, win 229, options [nop,nop,TS val 2847839374 ecr 2450258018], length 0
01:47:30.146792 IP (tos 0x0, ttl 64, id 30646, offset 0, flags [DF], proto TCP (6), length 89)
    172.17.0.1.49804 > 172.17.0.2.5201: Flags [P.], cksum 0x5871 (incorrect -> 0xa2a1), seq 1:38, ack 1, win 229, options [nop,nop,TS val 2847839374 ecr 2450258018], length 37
01:47:30.147686 IP (tos 0x0, ttl 255, id 0, offset 0, flags [none], proto TCP (6), length 52)
    172.17.0.2.5201 > 172.17.0.1.49804: Flags [.], cksum 0x408c (correct), seq 1, ack 38, win 0, options [nop,nop,TS val 2450258019 ecr 2847839374], length 0
01:47:30.148568 IP (tos 0x0, ttl 255, id 0, offset 0, flags [none], proto TCP (6), length 53)
    172.17.0.2.5201 > 172.17.0.1.49804: Flags [P.], cksum 0x3782 (correct), seq 1:2, ack 38, win 0, options [nop,nop,TS val 2450258020 ecr 2847839374], length 1
01:47:30.148603 IP (tos 0x0, ttl 64, id 30647, offset 0, flags [DF], proto TCP (6), length 52)
    172.17.0.1.49804 > 172.17.0.2.5201: Flags [.], cksum 0x584c (incorrect -> 0x3fa3), seq 38, ack 2, win 229, options [nop,nop,TS val 2847839376 ecr 2450258020], length 0
01:47:30.355635 IP (tos 0x0, ttl 64, id 30648, offset 0, flags [DF], proto TCP (6), length 52)
    172.17.0.1.49804 > 172.17.0.2.5201: Flags [.], cksum 0x584c (incorrect -> 0x3ed5), seq 37, ack 2, win 229, options [nop,nop,TS val 2847839583 ecr 2450258020], length 0
01:47:30.356242 IP (tos 0x0, ttl 255, id 0, offset 0, flags [none], proto TCP (6), length 52)
    172.17.0.2.5201 > 172.17.0.1.49804: Flags [.], cksum 0x3fb8 (correct), seq 2, ack 38, win 0, options [nop,nop,TS val 2450258228 ecr 2847839376], length 0
01:47:30.787651 IP (tos 0x0, ttl 64, id 30649, offset 0, flags [DF], proto TCP (6), length 52)
    172.17.0.1.49804 > 172.17.0.2.5201: Flags [.], cksum 0x584c (incorrect -> 0x3c55), seq 37, ack 2, win 229, options [nop,nop,TS val 2847840015 ecr 2450258228], length 0
01:47:30.788476 IP (tos 0x0, ttl 255, id 0, offset 0, flags [none], proto TCP (6), length 52)
    172.17.0.2.5201 > 172.17.0.1.49804: Flags [.], cksum 0x3d39 (correct), seq 2, ack 38, win 0, options [nop,nop,TS val 2450258660 ecr 2847839583], length 0
01:47:31.619638 IP (tos 0x0, ttl 64, id 30650, offset 0, flags [DF], proto TCP (6), length 52)
    172.17.0.1.49804 > 172.17.0.2.5201: Flags [.], cksum 0x584c (incorrect -> 0x3765), seq 37, ack 2, win 229, options [nop,nop,TS val 2847840847 ecr 2450258660], length 0
01:47:31.620285 IP (tos 0x0, ttl 255, id 0, offset 0, flags [none], proto TCP (6), length 52)
    172.17.0.2.5201 > 172.17.0.1.49804: Flags [.], cksum 0x3849 (correct), seq 2, ack 38, win 0, options [nop,nop,TS val 2450259492 ecr 2847840015], length 0
01:47:33.283647 IP (tos 0x0, ttl 64, id 30651, offset 0, flags [DF], proto TCP (6), length 52)
    172.17.0.1.49804 > 172.17.0.2.5201: Flags [.], cksum 0x584c (incorrect -> 0x2da5), seq 37, ack 2, win 229, options [nop,nop,TS val 2847842511 ecr 2450259492], length 0
01:47:33.284267 IP (tos 0x0, ttl 255, id 0, offset 0, flags [none], proto TCP (6), length 52)
    172.17.0.2.5201 > 172.17.0.1.49804: Flags [.], cksum 0x2e89 (correct), seq 2, ack 38, win 0, options [nop,nop,TS val 2450261156 ecr 2847840847], length 0
^C
64 packets captured

**Comment by hbhasker** [comment]
Gah Apologies. I think this was my WAI runsc binary which has a bug with rcvWnd. ITs advertising a receive window of zero after the accept. Let me try without my fixes and see.

**Comment by hbhasker** [comment]
Okay I fixed the bug and it works just fine. I am not seeing any issues. Any reason you are using port forwarding?

**Comment by hbhasker** [comment]
Okay could you create a /etc/docker/daemon.json with the following contents. The critical part is --gso=false. I believe we have a bug when GSO is turned on which is causing iperf3 to hang.

 "runsc-xemu": {
                        "path": "/usr/local/bin/runsc",
                        "runtimeArgs": [
                                "--debug-log",
                                "/tmp/runsc-xemu/logs/",
                                "--platform=xemu",
                                "--gso=false" 
                        ]
                },

**Comment by ustiugov** [comment]
Hi Bhasker,

Thank you for the updates. I am using port forwarding because I am modeling a Function-as-a-Service setting where micro-VMs are normally behind a NAT. For that reason, I rely on the docker default bridging.

Could you elaborate a bit more on what GSO is in gvisor?

I’ve also noticed the following problem when I used my own super simple TCP server inside a gvisor sandbox. When connections are established, the clients and the server can exchange packets but after my benchmark finishes, if I restart the client and the server, the connections time out and I have to restart the gvisor containers. It must be the same issue, I guess.

Thank you.

Regards,
Dmitrii

On Apr 13, 2019, at 6:01 AM, Bhasker Hariharan <notifications@github.com<mailto:notifications@github.com>> wrote:


Okay could you create a /etc/docker/daemon.json with the following contents. The critical part is --gso=false. I believe we have a bug when GSO is turned on which is causing iperf3 to hang.

"runsc-xemu": {
"path": "/usr/local/bin/runsc",
"runtimeArgs": [
"--debug-log",
"/tmp/runsc-xemu/logs/",
"--platform=xemu",
"--gso=false"
]
},

**Comment by hbhasker** [comment]
Hi Dmitrii,

GSO is Generic Segmentation Offload which was added recently to the network stack in gVisor. What that does is offloads large segments from the stack to the veth device which can then do the actual segmentation of TCP segments into MTU sized chunks. We do this by prepending a special vnet header when writing the packet to the veth device which causes the host kernel to do the segmentation based on the parameters specified in the header.

I believe we have some bug in the handling of small segments which is causing the iperf hang. When I disable GSO I do not see any hangs with iperf. We will take a look on monday and see if we can get a bug fix in quickly. But for now disabling GSO should help resolve the issue.

**Comment by ustiugov** [comment]
Thank you for the suggestion. Unfortunately, when I disable GSO in runsc as @hbhasker recommended, I run into another error on the server side:
```Server listening on 5201
-----------------------------------------------------------
Accepted connection from 10.90.72.68, port 47358
iperf3: error - unable to set TCP_CONGESTION: Supplied congestion control algorithm not supported on this host```

**Comment by hbhasker** [comment]
Could you provide the iperf command you are using.

**Comment by ustiugov** [comment]
From the server side:
`iperf3 -s`
From the client side
`iperf3 -c HOST_IP -p FORWARDED_PORT`

**Comment by hbhasker** [comment]
That's odd. I am unable to reproduce that. Could you strace the server and
put the log on the bug.

**Comment by avagin** [comment]
The GSO issue should be fixed by this PR: https://gvisor-review.git.corp.google.com/c/gvisor/+/16580

**Comment by hbhasker** [comment]
Dmitry,

I am unable to reproduce the error that you are seeing. Could you try the latest version of gvisor with Andrei's GSO fix and let me know if you are still seeing the error.

**Comment by avagin** [comment]
My fix has been merged into the upstream repo.
When I run the iperf test, I found that it fails even with native containers. It is another issue and it can be workarounded by enabling nf_conntrack_tcp_be_liberal:
```
$ sysctl -w net.netfilter.nf_conntrack_tcp_be_liberal=1
```

**Comment by hbhasker** [comment]
Dmitrii,
Could you provide an update on the iperf3 issue? Are you still experiencing it? I am unable to reproduce the congestion control error that you describe above.

**Comment by ustiugov** [comment]
Hi, sorry for the delay, I was out of town last week. The issue with the congestion control persists (gVisor, latest commit from Apr 25th, default setting, i.e., with GSO). 
Here is the log from strace from inside the microVM
```
/ # strace iperf3 -s                                                                                                                                                      [27/130]
execve("/usr/bin/iperf3", ["iperf3", "-s"], 0x7fab93c53e28 /* 5 vars */) = 0
arch_prctl(ARCH_SET_FS, 0x7f2614b3fb68) = 0
set_tid_address(0x7f2614b3fba8)         = 11
open("/etc/ld-musl-x86_64.path", O_RDONLY|O_CLOEXEC) = -1 ENOENT (No such file or directory)
open("/lib/libiperf.so.0", O_RDONLY|O_CLOEXEC) = -1 ENOENT (No such file or directory)
open("/usr/local/lib/libiperf.so.0", O_RDONLY|O_CLOEXEC) = -1 ENOENT (No such file or directory)
open("/usr/lib/libiperf.so.0", O_RDONLY|O_CLOEXEC) = 3
fcntl(3, F_SETFD, FD_CLOEXEC)           = 0
fstat(3, {st_mode=S_IFREG|0755, st_size=134480, ...}) = 0
read(3, "\177ELF\2\1\1\0\0\0\0\0\0\0\0\0\3\0>\0\1\0\0\0\230\214\0\0\0\0\0\0"..., 960) = 960
mmap(NULL, 143360, PROT_READ, MAP_PRIVATE, 3, 0) = 0x7f2614a88000
mmap(0x7f2614a90000, 61440, PROT_READ|PROT_EXEC, MAP_PRIVATE|MAP_FIXED, 3, 0x8000) = 0x7f2614a90000
mmap(0x7f2614a9f000, 32768, PROT_READ, MAP_PRIVATE|MAP_FIXED, 3, 0x17000) = 0x7f2614a9f000
mmap(0x7f2614aa8000, 12288, PROT_READ|PROT_WRITE, MAP_PRIVATE|MAP_FIXED, 3, 0x1f000) = 0x7f2614aa8000
mmap(0x7f2614aaa000, 4096, PROT_READ|PROT_WRITE, MAP_PRIVATE|MAP_FIXED|MAP_ANONYMOUS, -1, 0) = 0x7f2614aaa000
close(3)                                = 0
mprotect(0x7f2614aa8000, 4096, PROT_READ) = 0
mprotect(0x7f2614b3c000, 4096, PROT_READ) = 0
mprotect(0x5609bac6d000, 4096, PROT_READ) = 0
rt_sigprocmask(SIG_UNBLOCK, [RT_1 RT_2], NULL, 8) = 0
rt_sigaction(SIGINT, {sa_handler=0x5609bac6b537, sa_mask=[], sa_flags=SA_RESTORER|SA_RESTART, sa_restorer=0x7f2614af4802}, {sa_handler=SIG_DFL, sa_mask=[], sa_flags=0}, 8) = 0
rt_sigaction(SIGTERM, {sa_handler=0x5609bac6b537, sa_mask=[], sa_flags=SA_RESTORER|SA_RESTART, sa_restorer=0x7f2614af4802}, {sa_handler=SIG_DFL, sa_mask=[], sa_flags=0}, 8) = 0
rt_sigaction(SIGHUP, {sa_handler=0x5609bac6b537, sa_mask=[], sa_flags=SA_RESTORER|SA_RESTART, sa_restorer=0x7f2614af4802}, {sa_handler=SIG_DFL, sa_mask=[], sa_flags=0}, 8) = 0
rt_sigaction(SIGPIPE, {sa_handler=SIG_IGN, sa_mask=[], sa_flags=SA_RESTORER|SA_RESTART, sa_restorer=0x7f2614af4802}, {sa_handler=SIG_DFL, sa_mask=[], sa_flags=0}, 8) = 0
socket(AF_INET6, SOCK_STREAM, IPPROTO_IP) = 3
setsockopt(3, SOL_SOCKET, SO_REUSEADDR, [1], 4) = 0
setsockopt(3, SOL_IPV6, IPV6_V6ONLY, [0], 4) = 0
bind(3, {sa_family=AF_INET6, sin6_port=htons(5201), inet_pton(AF_INET6, "::", &sin6_addr), sin6_flowinfo=htonl(0), sin6_scope_id=0}, 28) = 0
listen(3, 2147483647)                   = 0
ioctl(1, TIOCGWINSZ, {ws_row=50, ws_col=178, ws_xpixel=0, ws_ypixel=0}) = 0
writev(1, [{iov_base="", iov_len=0}, {iov_base="--------------------------------"..., iov_len=60}], 2-----------------------------------------------------------
) = 60
writev(1, [{iov_base="", iov_len=0}, {iov_base="Server listening on 5201\n", iov_len=25}], 2Server listening on 5201
) = 25
writev(1, [{iov_base="", iov_len=0}, {iov_base="--------------------------------"..., iov_len=60}], 2-----------------------------------------------------------
) = 60
clock_gettime(CLOCK_PROCESS_CPUTIME_ID, {tv_sec=0, tv_nsec=20000000}) = 0
getrusage(RUSAGE_SELF, {ru_utime={tv_sec=0, tv_usec=10000}, ru_stime={tv_sec=0, tv_usec=10000}, ...}) = 0
select(4, [3], [], NULL, NULL)          = 1 (in [3])
accept(3, {sa_family=AF_INET6, sin6_port=htons(37892), inet_pton(AF_INET6, "::ffff:10.90.44.212", &sin6_addr), sin6_flowinfo=htonl(0), sin6_scope_id=0}, [128->28]) = 4
read(4, "icnals12.1556313395.882014.7cbab"..., 37) = 37
write(4, "\t", 1)                       = 1
read(4, "\0\0\09", 4)                   = 4
read(4, "{\"tcp\":true,\"omit\":0,\"time\":10,\""..., 57) = 57
getsockopt(3, SOL_SOCKET, SO_SNDBUF, [1048576], [4]) = 0
getsockopt(3, SOL_SOCKET, SO_RCVBUF, [1048576], [4]) = 0
write(4, "\n", 1)                       = 1
getpeername(4, {sa_family=AF_INET6, sin6_port=htons(37892), inet_pton(AF_INET6, "::ffff:10.90.44.212", &sin6_addr), sin6_flowinfo=htonl(0), sin6_scope_id=0}, [128->28]) = 0
getsockname(4, {sa_family=AF_INET6, sin6_port=htons(5201), inet_pton(AF_INET6, "::ffff:172.17.0.2", &sin6_addr), sin6_flowinfo=htonl(0), sin6_scope_id=0}, [128->28]) = 0
writev(1, [{iov_base="", iov_len=0}, {iov_base="Accepted connection from 10.90.4"..., iov_len=50}], 2Accepted connection from 10.90.44.212, port 37892
) = 50
select(5, [3 4], [], NULL, NULL)        = 1 (in [3])
accept(3, {sa_family=AF_INET6, sin6_port=htons(37894), inet_pton(AF_INET6, "::ffff:10.90.44.212", &sin6_addr), sin6_flowinfo=htonl(0), sin6_scope_id=0}, [128->28]) = 5
read(5, "icnals12.1556313395.882014.7cbab"..., 37) = 37
getsockopt(5, SOL_TCP, TCP_CONGESTION, 0x7f0dcf1a7d37, [16]) = -1 ENOPROTOOPT (Protocol not available)
close(5)                                = 0
close(4)                                = 0
close(3)                                = 0
writev(2, [{iov_base="iperf3: ", iov_len=8}, {iov_base="error - unable to set TCP_CONGES"..., iov_len=102}], 2iperf3: error - unable to set TCP_CONGESTION: Supplied congestion co
ntrol algorithm not supported on this host) = 110
writev(2, [{iov_base="\n", iov_len=1}, {iov_base=NULL, iov_len=0}], 2
) = 1
socket(AF_INET6, SOCK_STREAM, IPPROTO_IP) = 3
setsockopt(3, SOL_SOCKET, SO_REUSEADDR, [1], 4) = 0
setsockopt(3, SOL_IPV6, IPV6_V6ONLY, [0], 4) = 0
bind(3, {sa_family=AF_INET6, sin6_port=htons(5201), inet_pton(AF_INET6, "::", &sin6_addr), sin6_flowinfo=htonl(0), sin6_scope_id=0}, 28) = 0
listen(3, 2147483647)                   = 0
writev(1, [{iov_base="", iov_len=0}, {iov_base="--------------------------------"..., iov_len=60}], 2-----------------------------------------------------------
) = 60
writev(1, [{iov_base="", iov_len=0}, {iov_base="Server listening on 5201\n", iov_len=25}], 2Server listening on 5201
) = 25
writev(1, [{iov_base="", iov_len=0}, {iov_base="--------------------------------"..., iov_len=60}], 2-----------------------------------------------------------
) = 60
clock_gettime(CLOCK_PROCESS_CPUTIME_ID, {tv_sec=0, tv_nsec=30000000}) = 0
getrusage(RUSAGE_SELF, {ru_utime={tv_sec=0, tv_usec=20000}, ru_stime={tv_sec=0, tv_usec=10000}, ...}) = 0
select(5, [3], [], NULL, NULL
```

Please let me know if you need anything else.

**Comment by hbhasker** [comment]
Thanks I believe what is happening is the iperf3 client is sending parameters which include congestion control that is not supported. gVisor only supports reno and cubic. 

Could you provide the client parameters that you are passing to iperf3 -c ?

**Comment by ustiugov** [comment]
I am using the default parameters:
iperf3 -c IPADDR -p PORT

**Comment by hbhasker** [comment]
Hmm, could you provide the output of the following sysctl variables on the client side of iperf3?

On my host they look like following. I have a feeling the 3rd one is set to something different than cubic or reno on your host. I will read the iperf3 code to see from where it's picking the congestion control variable value.

net.ipv4.tcp_allowed_congestion_control = reno cubic bbr
net.ipv4.tcp_available_congestion_control = reno cubic bbr
net.ipv4.tcp_congestion_control = cubic

**Comment by ustiugov** [comment]
It looks like all these variables point to cubic:
```
ustiugov@icnals12:~/faas_study$ cat /proc/sys/net/ipv4/tcp_congestion_control
cubic
ustiugov@icnals12:~/faas_study$ cat /proc/sys/net/ipv4/tcp_allowed_congestion_control 
cubic reno
ustiugov@icnals12:~/faas_study$ cat /proc/sys/net/ipv4/tcp_congestion_control         
cubic

```

**Comment by ustiugov** [comment]
Lately I tried the same with an Ubuntu guest:
```
docker run -it --name ubuntu1 --runtime=runsc -p 52022:22 -p 42022:5201 ubuntu bash
```
The congestion control error does not appear there. Just FYI.

**Comment by hbhasker** [comment]
That's rather interesting. What Linux distribution were you using earlier. I should have asked this before!

**Comment by hbhasker** [comment]
Ah nm it's on the first comment. Alpine. I will try it out.

**Comment by amscanne** [comment]
Basker, any insights here? It would be great to finish triaging here, so that we could know if a fix needs to be prioritized.

**Comment by hbhasker** [comment]
I just verified. This issue was fixed w/ https://github.com/google/gvisor/commit/70578806e8d3e01fae2249b3e602cd5b05d378a0

iperf3 was failing due to the missing TCP_CONGESTION option for TCP sockets. I just tested this with an alpine3 docker image and it works fine.

 docker ps
CONTAINER ID        IMAGE               COMMAND             CREATED             STATUS              PORTS                                            NAMES
54f356794783        mlabbe/iperf3       "iperf3 -s"         50 seconds ago      Up 49 seconds       0.0.0.0:5201->5201/tcp, 0.0.0.0:5201->5201/udp   iperf3
bhaskerh@frostmourne:/google/src/cloud/bhaskerh/fig-workspace/google3$ iperf3 -c localhost
Connecting to host localhost, port 5201
[  5] local ::1 port 42108 connected to ::1 port 5201
[ ID] Interval           Transfer     Bitrate         Retr  Cwnd
[  5]   0.00-1.00   sec   306 MBytes  2.57 Gbits/sec    1   4.00 MBytes       
[  5]   1.00-2.00   sec   172 MBytes  1.45 Gbits/sec    2   4.00 MBytes       
[  5]   2.00-3.00   sec   178 MBytes  1.49 Gbits/sec    0   2.00 MBytes       
[  5]   3.00-4.00   sec   379 MBytes  3.18 Gbits/sec    7   1.37 MBytes       
[  5]   4.00-5.00   sec   306 MBytes  2.57 Gbits/sec    0   1.37 MBytes       
[  5]   5.00-6.00   sec   226 MBytes  1.90 Gbits/sec    1   1.37 MBytes       
[  5]   6.00-7.00   sec   299 MBytes  2.51 Gbits/sec    1   1.37 MBytes       
[  5]   7.00-8.00   sec   139 MBytes  1.16 Gbits/sec    1   1.37 MBytes       
[  5]   8.00-9.00   sec   204 MBytes  1.71 Gbits/sec    1   1.37 MBytes       
[  5]   9.00-10.00  sec   354 MBytes  2.97 Gbits/sec    2   1.37 MBytes       
- - - - - - - - - - - - - - - - - - - - - - - - -
[ ID] Interval           Transfer     Bitrate         Retr
[  5]   0.00-10.00  sec  2.50 GBytes  2.15 Gbits/sec   16             sender
[  5]   0.00-10.04  sec  2.49 GBytes  2.13 Gbits/sec                  receiver

iperf Done.
