### ISSUE TITLE
Open database TCP connection failing after a period of time

### ISSUE THREAD

**Issue by Champ-Goblem** [google/gvisor#6317]
**Description**

We seem to be experiencing an issue where long lived tcp connections between a client and a mysql database fail after a period of time when both containers are running on gvisor, with an istio-proxy sidecar and mtls enabled. The connection tends to timeout sometime between 20 minutes and 70 minutes with failures that happen at regular intervals (eg 21m, 41m, 61m). When the same workload is run without gvisor we dont experience any connection problems and the job being run completes within 45 minutes. We have spent some time debugging this issue and have looked over traces of system calls at the time of failures, taken tcp dumps and debugged runsc with delve but are still unsure what could be causing the problem.

The issues seems to stem from the client side rather than the server side as running the mysql server without gvisor still experiences connection timeouts, but with mysql running on gvisor and the client not, the job completes successfully. I think we may need someone with experience on gvisor's network stack to give some pointers as where to look for further debugging on our end or to potentially investigate themselves. The attached zip folder should contain all of the necessary scripts and resources to setup a failing test on a new cluster provided gvisor has already been setup. The test provided was written in PHP but has also failed in other languages as well.

We have also witnessed occasions where the workload doesnt fail explicitly but stops updating database entries after a period of time and just hangs on some entry. This can be observed for the current test when the logs stop on some entry for a indefinite period of time eg `Shop: <number>`.

**Steps to reproduce**

- Spin up a new cluster with gvsior installed
- Install istio 1.9.5 with the script `istio/deploy.sh` (requires istioctl)
- Label a testing namespace with `istio-injection: enabled`
- Deploy the mysql database with `db/deploy.sh` (requires helm)
- Once the database is running (`2/2` status) add some values to it with `db/insert-data.sh` script and wait for the `insert-data` job to finish (takes a few minutes)
- Optionally you can build the app with `app/build.sh` passing an argument for image name and tag (eg `build.sh "eu.gcr.io/<name>:latest"`) (requires docker)
- Deploy the app with `app/deploy.sh` either using our prebuilt public image, or one built in the previous step
- Leave the `php-mysql-tcp-test` job running and see if it fails with the error:
```
Fatal error: Uncaught PDOException: SQLSTATE[HY000]: General error: 2006 MySQL server has gone away in /var/php/job-sleep.php:32
Stack trace:
#0 /var/php/job-sleep.php(32): PDOStatement->execute()
#1 {main}
thrown in /var/php/job-sleep.php on line 32
```

The PHP app opens a connection to the database and performs a read of all the entries in the db, then follows by waiting for a minute before updating each entry one by one. Between each subsequent update the wait time is roughly 2 minutes, and these waits can be controlled by the `TIMEOUT` environment variable.

A public version of the same image has been built and published to docker hub and this is used by default when `app/deploy.sh` is run: https://hub.docker.com/r/deciderwill/php-sleep-gvisor-tcp-debug

The same files in the attached zip folder are also available at: https://github.com/northflank/mysql-tcp-connection-problems-gvisor

**Environment**

- k8s: `v1.19.10-gke.1700` through to `v1.20.7-gke.1800`
- runsc:
        version prebuilt on gke node:
	```
	runsc version google-367396767
	spec: 1.0.1-dev
	```
	and a release version that was tested manually that also experienced the issue:
	```
	release-20210628.0
	```
- kernel: `Linux 5.4.104+ #1 SMP Tue Apr 6 09:49:56 PDT 2021 x86_64 Intel(R) Xeon(R) CPU @ 2.00GHz GenuineIntel GNU/Linux`
- containerd: `1.4.3`

[gvisor-issue.zip](https://github.com/google/gvisor/files/6817835/gvisor-issue.zip)

**Comment by Champ-Goblem** [comment]
@kevinGC Let us know if we can help in anyway or jump on a call with you to show the issues live

**Comment by hbhasker** [comment]
@kevinGC  could you take a look?

**Comment by kevinGC** [comment]
Yep, I'll take a look. I suspect this has to do with how we track TCP state
in long-lived connections in combination with iptables.

**Comment by hbhasker** [comment]
@Champ-Goblem I am looking at the pcap but a few things are not making sense to me.

There seem to be a few IP addresses involved.

Looks like client is 10.64.0.28 and MySQL server is running on 10.60.25.244 (from the DNS response). But then the pcap is all between 10.64.0.28 and 10.64.0.26 (where 10.64.0.26 seems to be the IP of the mysql server). Is this capture being done from inside the sandbox? or on the host?

Another strange behaviour I see is Netstack does not seem to be accepting the RSTs sent by MySQL server in a case ( as seen by the repeated retransmissions despite the incoming RST from the server.) Its possible that with envoy in the middle these RSTs are never reaching the netstack endpoint and it just keeps retransmitting. But its hard to say.

That said, this pcap is only about 18 minutes long , was this the only failure observed? 

Given that these issues only come up when using istio, there is a high likelihood that this is a bug in our IPTable / connection tracking code. That said its unclear to me why this specific connection did not get NATted? That should have been redirected like all the other MySQL connections but looks like this one for some reason did not.  

```
No.	Time	Source	Destination	Protocol	Length	Info
1272	2021-10-13 14:59:45.102072	10.64.0.28	10.60.25.244	MySQL	114	Request Query
1273	2021-10-13 14:59:45.102356	10.60.25.244	10.64.0.28	TCP	54	3306 → 55096 [RST] Seq=3219989980 Win=0 Len=0
1283	2021-10-13 14:59:46.102696	10.64.0.28	10.60.25.244	TCP	114	[TCP Retransmission] 55096 → 3306 [PSH, ACK] Seq=804228880 Ack=3219989980 Win=7063 [TCP CHECKSUM INCORRECT] Len=48 TSval=3394053121 TSecr=1525322972
1284	2021-10-13 14:59:46.103015	10.60.25.244	10.64.0.28	TCP	54	3306 → 55096 [RST] Seq=3219989980 Win=0 Len=0
1285	2021-10-13 14:59:46.303796	10.64.0.28	10.60.25.244	TCP	114	[TCP Retransmission] 55096 → 3306 [PSH, ACK] Seq=804228880 Ack=3219989980 Win=7063 [TCP CHECKSUM INCORRECT] Len=48 TSval=3394053322 TSecr=1525322972
1286	2021-10-13 14:59:46.304079	10.60.25.244	10.64.0.28	TCP	54	3306 → 55096 [RST] Seq=3219989980 Win=0 Len=0
1289	2021-10-13 14:59:46.704025	10.64.0.28	10.60.25.244	TCP	114	[TCP Retransmission] 55096 → 3306 [PSH, ACK] Seq=804228880 Ack=3219989980 Win=7063 [TCP CHECKSUM INCORRECT] Len=48 TSval=3394053722 TSecr=1525322972
1290	2021-10-13 14:59:46.704297	10.60.25.244	10.64.0.28	TCP	54	3306 → 55096 [RST] Seq=3219989980 Win=0 Len=0
1309	2021-10-13 14:59:47.504480	10.64.0.28	10.60.25.244	TCP	114	[TCP Retransmission] 55096 → 3306 [PSH, ACK] Seq=804228880 Ack=3219989980 Win=7063 [TCP CHECKSUM INCORRECT] Len=48 TSval=3394054523 TSecr=1525322972
1310	2021-10-13 14:59:47.504757	10.60.25.244	10.64.0.28	TCP	54	3306 → 55096 [RST] Seq=3219989980 Win=0 Len=0
1322	2021-10-13 14:59:49.105596	10.64.0.28	10.60.25.244	TCP	114	[TCP Retransmission] 55096 → 3306 [PSH, ACK] Seq=804228880 Ack=3219989980 Win=7063 [TCP CHECKSUM INCORRECT] Len=48 TSval=3394056124 TSecr=1525322972
1323	2021-10-13 14:59:49.105863	10.60.25.244	10.64.0.28	TCP	54	3306 → 55096 [RST] Seq=3219989980 Win=0 Len=0
1344	2021-10-13 14:59:52.306558	10.64.0.28	10.60.25.244	TCP	114	[TCP Retransmission] 55096 → 3306 [PSH, ACK] Seq=804228880 Ack=3219989980 Win=7063 [TCP CHECKSUM INCORRECT] Len=48 TSval=3394059325 TSecr=1525322972
1345	2021-10-13 14:59:52.306820	10.60.25.244	10.64.0.28	TCP	54	3306 → 55096 [RST] Seq=3219989980 Win=0 Len=0
1385	2021-10-13 14:59:58.707511	10.64.0.28	10.60.25.244	TCP	114	[TCP Retransmission] 55096 → 3306 [PSH, ACK] Seq=804228880 Ack=3219989980 Win=7063 [TCP CHECKSUM INCORRECT] Len=48 TSval=3394065726 TSecr=1525322972
1386	2021-10-13 14:59:58.707757	10.60.25.244	10.64.0.28	TCP	54	3306 → 55096 [RST] Seq=3219989980 Win=0 Len=0
1457	2021-10-13 15:00:11.508128	10.64.0.28	10.60.25.244	TCP	114	[TCP Retransmission] 55096 → 3306 [PSH, ACK] Seq=804228880 Ack=3219989980 Win=7063 [TCP CHECKSUM INCORRECT] Len=48 TSval=3394078526 TSecr=1525322972
1458	2021-10-13 15:00:11.508388	10.60.25.244	10.64.0.28	TCP	54	3306 → 55096 [RST] Seq=3219989980 Win=0 Len=0
1636	2021-10-13 15:00:37.108599	10.64.0.28	10.60.25.244	TCP	114	[TCP Retransmission] 55096 → 3306 [PSH, ACK] Seq=804228880 Ack=3219989980 Win=7063 [TCP CHECKSUM INCORRECT] Len=48 TSval=3394104127 TSecr=1525322972
1637	2021-10-13 15:00:37.108872	10.60.25.244	10.64.0.28	TCP	54	3306 → 55096 [RST] Seq=3219989980 Win=0 Len=0
1978	2021-10-13 15:01:28.309714	10.64.0.28	10.60.25.244	TCP	114	[TCP Retransmission] 55096 → 3306 [PSH, ACK] Seq=804228880 Ack=3219989980 Win=7063 [TCP CHECKSUM INCORRECT] Len=48 TSval=3394155328 TSecr=1525322972
1979	2021-10-13 15:01:28.309954	10.60.25.244	10.64.0.28	TCP	54	3306 → 55096 [RST] Seq=3219989980 Win=0 Len=0
2639	2021-10-13 15:03:10.710837	10.64.0.28	10.60.25.244	TCP	114	[TCP Retransmission] 55096 → 3306 [PSH, ACK] Seq=804228880 Ack=3219989980 Win=7063 [TCP CHECKSUM INCORRECT] Len=48 TSval=3394257729 TSecr=1525322972
2640	2021-10-13 15:03:10.711132	10.60.25.244	10.64.0.28	TCP	54	3306 → 55096 [RST] Seq=3219989980 Win=0 Len=0
3421	2021-10-13 15:05:10.711449	10.64.0.28	10.60.25.244	TCP	114	[TCP Retransmission] 55096 → 3306 [PSH, ACK] Seq=804228880 Ack=3219989980 Win=7063 [TCP CHECKSUM INCORRECT] Len=48 TSval=3394377730 TSecr=1525322972
3422	2021-10-13 15:05:10.711757	10.60.25.244	10.64.0.28	TCP	54	3306 → 55096 [RST] Seq=3219989980 Win=0 Len=0
4207	2021-10-13 15:07:10.711625	10.64.0.28	10.60.25.244	TCP	114	[TCP Retransmission] 55096 → 3306 [PSH, ACK] Seq=804228880 Ack=3219989980 Win=7063 [TCP CHECKSUM INCORRECT] Len=48 TSval=3394497730 TSecr=1525322972
4208	2021-10-13 15:07:10.711966	10.60.25.244	10.64.0.28	TCP	54	3306 → 55096 [RST] Seq=3219989980 Win=0 Len=0
4995	2021-10-13 15:09:10.712737	10.64.0.28	10.60.25.244	TCP	114	[TCP Retransmission] 55096 → 3306 [PSH, ACK] Seq=804228880 Ack=3219989980 Win=7063 [TCP CHECKSUM INCORRECT] Len=48 TSval=3394617731 TSecr=1525322972
4996	2021-10-13 15:09:10.713081	10.60.25.244	10.64.0.28	TCP	54	3306 → 55096 [RST] Seq=3219989980 Win=0 Len=0
5780	2021-10-13 15:11:10.713126	10.64.0.28	10.60.25.244	TCP	114	[TCP Retransmission] 55096 → 3306 [PSH, ACK] Seq=804228880 Ack=3219989980 Win=7063 [TCP CHECKSUM INCORRECT] Len=48 TSval=3394737731 TSecr=1525322972
5781	2021-10-13 15:11:10.713427	10.60.25.244	10.64.0.28	TCP	54	3306 → 55096 [RST] Seq=3219989980 Win=0 Len=0
```

**Comment by hbhasker** [comment]
NOTE: I opened an issue for a bug I observed in our tcp_conntrack which may also cause some of these odd behaviours. 

See: https://github.com/google/gvisor/issues/6734

**Comment by hbhasker** [comment]
BTW independent of the other HTTP failure issue has this been resolved now @HEAD?

**Comment by DeciderWill** [comment]
@hbhasker yes at the moment we believe the changes to HEAD have resolved the above issue.

**Comment by hbhasker** [comment]
Thanks for confirming. Closing this issue.
