### ISSUE TITLE
A normal container cannot connect to the container running on runsc.

### ISSUE THREAD

**Issue by ooyyloo** [google/gvisor#2835]
**Description**

Hi~. I'm using gVisor. I encounter a problem. When I use VPS, the container which is running on runc cannot connect to the container running on runsc. "cannot connect" here means "ping" fails and "http request". However, when I use my own PC, it just works well. Do you have any ideas about this?

daemon.json:
```
{
    "runtimes": {
        "runsc": {
            "path": "/usr/local/bin/runsc",
            "runtimeArgs": [
                "--debug",
                "--debug-log=/tmp/runsc/",
                "--strace",
                "--log-packets"
            ]
        }
    }
}
```

**Test: Sending HTTP request**

I use tcpdump to capture packets of a container, which is running on runc. It captures ARP broadcast packets to a container (I get ARP broadcast packets captured in this container also) running on runsc, but no response for the ARP broadcast. 
The container running on runsc is built from image "ubuntu:18.04"; the container running on runc is built from image "node:12".

**Steps to reproduce**

Use SA2.SMALL2 of Tencent Cloud and docker-compose command to deploy my project. If the project is necessary to debug, please let me know.

**Run ifconfig in runsc container**
I notice that there's no ip address of eth0 when I run ifconfig.

```
root@VM-0-13-ubuntu:~# ifconfig
eth0      Link encap:Ethernet  HWaddr 02:42:ac:xx:xx:xx
          UP BROADCAST RUNNING MULTICAST  MTU:1500  Metric:1
          RX packets:33 errors:0 dropped:0 overruns:0 frame:0
          TX packets:0 errors:0 dropped:0 overruns:0 carrier:0
          collisions:0 txqueuelen:0
          RX bytes:1722 (1.7 KB)  TX bytes:0 (0.0 B)

lo        Link encap:Local Loopback
          inet addr:127.0.0.1  Mask:255.0.0.0
          UP LOOPBACK RUNNING  MTU:65536  Metric:1
          RX packets:0 errors:0 dropped:0 overruns:0 frame:0
          TX packets:0 errors:0 dropped:0 overruns:0 carrier:0
          collisions:0 txqueuelen:1
          RX bytes:0 (0.0 B)  TX bytes:0 (0.0 B)
```

**Environment**

Please include the following details of your environment:

*   `runsc -v`
runsc version release-20200323.0
spec: 1.0.1-dev
*   `docker version` or `docker info` (if available)
19.03.9
*   `kubectl version` and `kubectl get nodes` (if using Kubernetes)
*   `uname -a`
Linux VM-0-13-ubuntu 4.4.0-157-generic #185-Ubuntu SMP Tue Jul 23 09:17:01 UTC 2019 x86_64 x86_64 x86_64 GNU/Linux
*   `git describe` (if built from source)
*   `runsc` debug logs (if available)
https://gist.github.com/ooyyloo/5a22a9cda30c8e2c55b2850900582e03

**Comment by tanjianfeng** [comment]
Can you share more about it? It failes on arp query, or tcp connection establishment, or http request?

Netstack is used here as the network stack according to your config. And your kernel version is 4.4.0. Netstack requires a newer version of kernel, >= 4.14.77+. IIUIC, that requirement is to make gso work.

**Comment by ooyyloo** [comment]
> Can you share more about it? It failes on arp query, or tcp connection establishment, or http request?
> 
> Netstack is used here as the network stack according to your config. And your kernel version is 4.4.0. Netstack requires a newer version of kernel, >= 4.14.77+. IIUIC, that requirement is to make gso work.

**Comment by ooyyloo** [comment]
**With runc**
root@VM-0-13-ubuntu:~# tcpdump
tcpdump: verbose output suppressed, use -v or -vv for full protocol decode
listening on eth0, link-type EN10MB (Ethernet), capture size 262144 bytes
14:53:46.906208 ARP, Request who-has 172.18.0.2 tell 172.18.0.7, length 28
14:53:46.906521 IP 172.18.0.3.41225 > 183.60.83.19.domain: 48729+ PTR? 2.0.18.172.in-addr.arpa. (41)
14:53:46.908318 IP 183.60.83.19.domain > 172.18.0.3.41225: 48729 NXDomain* 0/1/0 (100)
14:53:46.908373 IP 172.18.0.3.48394 > 183.60.83.19.domain: 58457+ PTR? 7.0.18.172.in-addr.arpa. (41)
14:53:46.910520 IP 183.60.83.19.domain > 172.18.0.3.48394: 58457 NXDomain* 0/1/0 (100)
14:53:46.910577 IP 172.18.0.3.58601 > 183.60.83.19.domain: 17581+ PTR? 19.83.60.183.in-addr.arpa. (43)
14:53:46.914213 IP 183.60.83.19.domain > 172.18.0.3.58601: 17581 NXDomain 0/1/0 (101)
14:53:46.914250 IP 172.18.0.3.56195 > 183.60.83.19.domain: 47727+ PTR? 3.0.18.172.in-addr.arpa. (41)
14:53:51.922072 ARP, Request who-has 172.18.0.1 tell 172.18.0.3, length 28
14:53:51.922080 ARP, Request who-has 172.18.0.3 tell 172.18.0.1, length 28
14:53:51.922097 ARP, Reply 172.18.0.3 is-at 02:42:ac:12:00:03 (oui Unknown), length 28
14:53:51.922093 ARP, Reply 172.18.0.1 is-at 02:42:34:1e:82:91 (oui Unknown), length 28
14:53:51.922179 IP 172.18.0.3.53543 > 183.60.83.19.domain: 50292+ PTR? 1.0.18.172.in-addr.arpa. (41)
14:53:51.924940 IP 183.60.83.19.domain > 172.18.0.3.53543: 50292 NXDomain* 0/1/0 (100)

**With runsc**
root@VM-0-13-ubuntu:~# tcpdump
tcpdump: verbose output suppressed, use -v or -vv for full protocol decode
listening on eth0, link-type EN10MB (Ethernet), capture size 262144 bytes
15:00:12.313791 ARP, Request who-has 172.20.0.2 tell 172.20.0.7, length 28
15:00:13.310082 ARP, Request who-has 172.20.0.2 tell 172.20.0.7, length 28
15:00:14.310079 ARP, Request who-has 172.20.0.2 tell 172.20.0.7, length 28
15:00:15.310124 ARP, Request who-has 172.20.0.2 tell 172.20.0.7, length 28
15:00:16.310083 ARP, Request who-has 172.20.0.2 tell 172.20.0.7, length 28
15:00:17.310080 ARP, Request who-has 172.20.0.2 tell 172.20.0.7, length 28

**Comment by ooyyloo** [comment]
Updating the kernel to a newer version solves this problem. The kernel of version 4.4.0 seems to be older than the kernel of version 3.17.
